학부,제목,링크,내용,작성일
생활복지학과,[교직] 2025학년도 상반기 교직 적성·인성검사 실시 안내,https://welfare.jnu.ac.kr/bbs/welfare/1702/907136/artclView.do,"가. 검사 신청 기간: 2025. 3. 4.(화) ~ 3. 10.(월)나. 신청 방법: 【포털 교육지원 내학사행정 교직 교직적 인성검사】에서 학생이 직접 신청다. 검사 일시: 2025. 4. 7.(월) ~ 4. 12.(토), 12:00~12:45 [6개 분반]※ 각 분반별 신청 인원 제한 없음.라. 검사 장소: 추후 공지(광주캠퍼스에서만 실시)마. 준비물: 신분증(주민등록증, 운전면허증, 학생증 등) 및 컴퓨터용 수성사인펜 반드시 지참바. 유의 사항: 【붙임】 참조",2025-01-31 14:05:15.0
생활복지학과,[홍보] 2025 한국소비자원 제9기 소비자안전모니터 활동 안내,https://welfare.jnu.ac.kr/bbs/welfare/1702/906871/artclView.do,"2025 한국소비자원 제9기 소비자안전모니터 활동 안내 1. 모집 기간: 2025.01.20.(월) ~ 2025.02.07.(금)2. 모집 인원: 소비자 안전에 관심 있는 만 18세 이상 대한민국 국민 20팀(팀 당 2~3명)3. 활동내용- 생활 속 위해정보 신고 및 모니터링- 소비자안전 정보 콘텐츠 제작 및 확산- 소비자안전 관련 법, 제도 동향 정보 수집- 차수별(분기별) 간담회 참석4. 활동기간- 2025년 2월 ~ 12월(약 10개월)- 2월 중 발대식 및 사전 교육 예정(대면)* 내 외부 환경에 따라 일정 변경 가능",2025-01-23 13:02:01.0
생활복지학과,2024학년도 느티나무 장학금 신청 안내,https://welfare.jnu.ac.kr/bbs/welfare/1702/906291/artclView.do,"2024학년도 느티나무 장학금 신청 안내 가. 장학금액: 1인당 1,000천원 혹은 500천원 (기준별 상이)나. 지원기준1) 대상: 학부 재적생(재학생, 등록휴학생)으로 다음 조건에 해당하는 자- 국가고시, 공인자격증 등 당해연도 해당 시험에 1차 합격한 자- 각종 대외활동 등을 통해 당해연도 당선 또는 수상한 자2) 지원제한: 장학 공고일 기준( 25.1.15.) 미등록 휴학생, 근신 이상의 징계처분을 받은 자3) 수혜횟수 제한: 동일 자격에 대해서는 1회만 지원다. 신청 및 장학금 지급1) 신청기간: 2025. 1. 15.(",2025-01-16 15:08:09.0
생활복지학과,2025학년도 2학기 해외 파견 교환학생 선발 홍보 요청,https://welfare.jnu.ac.kr/bbs/welfare/1702/905871/artclView.do,"2025학년도 2학기 해외 파견 교환학생 선발 홍보 요청 가. 파견대학 및 선발 예정인원: 23개국 59개교 177명- 이 중 22개국 48개 대학은 대학원생 지원 가능 (엑셀파일에 별도 표기됨)- 일본, 중국은 2차 모집 시 지원 가능나. 파견기간: 2025년 7월 ~ 2026년 5월 중 (한 학기 또는 1년 파견)다. 추진일정1) 모집공고 및 신청서 접수:-1차:  25. 1. 6.(월) ~ 1. 20.(월)-2차:  25. 2. 17.(월) ~ 3. 4.(화)2) 선발시험(외국어 구술 및 면접):  25. 1. 22.(수)3",2025-01-13 10:17:28.0
생활복지학과,2025학년도 제1학기 등록 안내,https://welfare.jnu.ac.kr/bbs/welfare/1702/905301/artclView.do,"2025학년도 제1학기 등록 안내 가. 등록기간: 2025. 2. 18.(화) ~ 2. 21.(금) 16:00까지 [4일간]나. 등록장소: 광주은행, 농협(지역농협 포함), 국민은행, 신한은행 전국 본 지점※ 등록금고지서는 우편 발송되지 않음(분할납부도 발송안됨)2. 분할납부제도 운영가. 신청기간: 2025. 1. 6.(월) ~ 2. 3.(월) [29일간]나. 선택횟수: 분할납부 2회, 3회, 4회 선택 가능다. 신청절차: 학생이 직접 우리 대학교 홈페이지 또는 전남대학교 포털에 접속하여 신청(포털-로그인-교육지원-내학사행정-등록",2025-01-07 20:02:07.0
생활복지학과,2024학년도 전기(2025년 2월) 학부 졸업(수료)대상자 유보 신청자 유보비 납부 안내,https://welfare.jnu.ac.kr/bbs/welfare/1702/905297/artclView.do,"2024학년도 전기(2025년 2월) 학부 졸업(수료)대상자 유보 신청자 유보비 납부 안내 가. 유보비 납부 대상: 409명(수료유보 204명, 졸업유보 205명)※ 향후 졸업사정 결과에 따라 위 인원은 변동될 수 있음나. 유보비 납부기간: 2025. 1. 20.(월) 09:00~1. 22.(수) 16:00까지(추가 납부기간 없음) ※ 등록금 미확정으로 인하여 유보비 납부 기간 변경 / 미납시 유보 신청 취소, 등록 기간 내 은행 업무 마감시간(16:00) 이후 납부 불가, 추가 납부기간 없음다. 납부은행 및 계좌: 광주은행(고지",2025-01-07 19:28:19.0
생활복지학과,2024학년도 공인 외국어 시험 응시료 지원 안내,https://welfare.jnu.ac.kr/bbs/welfare/1702/904683/artclView.do,"2024학년도 공인 외국어 시험 응시료 지원 안내 1. 신청 대상: 생활복지학과 재학생 1~4학년 누구나 (부*복수 전공자 제외)2. 지원 대상: 2024년 실시하는 모든 공인 외국어 시험(※ 시험 응시일자 2024.01.01. 이후)3. 지원 금액: 응시료 실비 지원(지원 현황에 따라 금액 변동 가능) / 연 1회 한정4. 제출 서류: 1) 응시료 지원금 신청서 1부 (첨부파일 서식 확인) 2) 공인 외국어 시험 성적표 1부 3) 통장사본 1부, 지출 영수증(응시료 결제 영수증) 1부5. 신청 방법 및 기한: 2025.01.17",2025-01-02 15:47:34.0
생활복지학과,[교직] 2025학년도 교직과정이수자 학교현장실습 안내,https://welfare.jnu.ac.kr/bbs/welfare/1702/904527/artclView.do,"2025학년도 교직과정이수자 학교현장실습 안내 1. 학교현장실습 기간: 2025. 5. 6.(화) ~ 2025. 5. 30.(금)[4주간]2. 수강신청 교과목(교과목코드): 학교현장실습(EDU9004)3. 오리엔테이션(OT) 안내 ▫ 일시: 2025. 3. 4.(화) 17:00~18:00▫ 장소: [광주] 전남대학교 사범대학 사림홀(예정)※ 사전 교육 자료 당일 배부(예정)4. 실습비 납부▫ 기간: 2025. 3. 4.(화) ~ 2025. 3. 6.(목) [3일간]▫ 금액: 실습생 1인당 100,000원▫ 방법(계좌송금): 신협",2024-12-31 14:10:17.0
생활복지학과,[교직] 2024학년도 전기(2025년 2월) 교원자격무시험검정 신청 안내,https://welfare.jnu.ac.kr/bbs/welfare/1702/904525/artclView.do,"2024학년도 전기(2025년 2월) 교원자격무시험검정 신청 안내 가. 제출 대상: 2024학년도 전기(2025년 2월) 졸업 예정자, 기 졸업자 중 교원자격취득 대상자나. 제출 서류:1) 교원자격무시험검정원서※ 복수 전공인경우 해당 학과(전공)별로 1매씩 작성하여 주전공학과로 제출2) 마약류 중독여부 확인을 위한 의사 진단서 또는 건강검진 결과 통보서 : 개인별 검사 후 제출3) 성범죄 경력 확인 : 교원자격 무시험검정원서에 동의 서명 확인다. 제출 기한: 25.01.08.(수)까지 학과사무실로 원본 제출",2024-12-31 13:58:32.0
생활복지학과,2024학년도 신(편)입생 미수령 학생증(스마트카드) 배부 안내,https://welfare.jnu.ac.kr/bbs/welfare/1702/904231/artclView.do,2024학년도 신(편)입생 미수령 학생증(스마트카드) 배부 안내 1. 배부 대상: 학부 및 대학원 신(편)입생 중 미수령 학생2. 배부 기간: 2024. 12. 18.(수) ~ 3. 배부 방법: 미수령자는 학과실 방문 요망,2024-12-26 00:02:18.0
생활복지학과,2025학년도 1학기 대학직장 예비군 전입 신청 및 개인 정보 수정 안내,https://welfare.jnu.ac.kr/bbs/welfare/1702/904229/artclView.do,"2025학년도 1학기 대학직장 예비군 전입 신청 및 개인 정보 수정 안내 가. 대상: 2025학년도 1학기 대학(원) 재학생[신입(재입학), 편입, 복학, 전과생 포함]1) 신청 기간: 2025. 1. 2.(목) ~2) 신청 절차: 전남대학교 포털 내 학사행정 예비군 예비군 전입 신청3) 전입 신청 4~5일 경과 후 예비군 홈페이지에서 소속 부대 변경 여부 확인나. 소속 부대 확인 및 개인 정보 수정 절차구분소속 부대 확인개인정보 수정절차예비군 홈페이지 나의 훈련정보 소속예비군 홈페이지 나의 훈련정보 개인정보 수정비고전남대학교연대",2024-12-25 23:58:44.0
생활복지학과,2025학년도 1학기 모집단위간이동(전과) 실시 안내 (★신청 기간 변경),https://welfare.jnu.ac.kr/bbs/welfare/1702/904228/artclView.do,2025학년도 1학기 모집단위간이동(전과) 실시 안내 가. 주요 일정업무명날짜비고공고2024. 12. 18.(수)홈페이지원서 접수2025. 01. 08.(수) ~ 1. 10. (금)포털 신청전출 승인2025. 1. 13.(월)학과(부) 및 대학전출 사정부 제출2025. 1. 14.(화)까지대학   본부전출 합격자 발표2025. 1. 17.(금)홈페이지전입 대상자 내신 후 명단 제출2025. 1. 24.(금)까지대학   본부전과 합격자 발표2025. 1. 31.(금)홈페이지전과 합격자 이수 성적 재사정표 제출 및 교과 구분 정정20,2024-12-25 23:56:27.0
생활복지학과,2025학년도 1학기 학·석사학위연계과정 및 학·석박사학위통합연계과정자 모집 안내,https://welfare.jnu.ac.kr/bbs/welfare/1702/904227/artclView.do,"2025학년도 1학기 학 석사학위연계과정 및 학 석박사학위통합연계과정자 모집 안내 ▢ 일정 및 지원절차 ▢구  분일  정절차 및 방법비  고지원서 접수 25. 1. 2.(목)~ 1. 10.(금)지원자 ⇨ 단과대학 행정실#9312;연계과정 지원서#9313;지원학과 지도예정교수 추천서#9314;성적확인서(*당해학기 포함)#9315;연구활동계획서전형(심사) 25. 1. 13.(월)~ 1. 17.(금)대학원 모집단위별 시행 결과제출 25. 1. 21.(화)까지대학 ⇨ 대학원사정내역부, 회의록, 지원서류 등(PDF 공문제출)※ 원본 대학자",2024-12-25 23:51:20.0
생활복지학과,2025학년도 1학기 학부 및 대학원 재입학 실시 안내,https://welfare.jnu.ac.kr/bbs/welfare/1702/904224/artclView.do,2025학년도 1 학기 학부 및 대학원 재입학 실시 안내 가. 세부 일정업무명일정비고실시 공고2024. 12. 16.(월)대학 홈페이지 공지(본부)재입학 원서접수2025. 1. 2.(목) ~ 1. 8.(수)학생   학과(부)대상자 내신2025. 1. 9.(목) ~ 1. 21.(화)학과(부)   단과대학   학사과재입학 허가2025. 1. 27.(월)대학 홈페이지 공지(본부)나. 재입학 대상자 및 제외자대상자제외자학부생대학원생◦미복학 미등록 학사경고 제적자 및 자퇴자◦학칙 제30조 4항에 해당하는 학생활동 제적자 ◦유급 및 징계에,2024-12-25 23:44:47.0
생활복지학과,"2025학년도 1학기 부·복수(연계)·융합전공, 마이크로디그리 취소 신청 및 이수자 선발 안내",https://welfare.jnu.ac.kr/bbs/welfare/1702/904222/artclView.do,"2025학년도 1학기 부 복수(연계) 융합전공, 마이크로디그리 취소 신청 및 이수자 선발 안내 업무 구분추진 일자비고비고공고2024. 12. 19.(목)공문시행 및 홈페이지 공고 취소 신청2025. 1. 2.(목) ~ 1. 6.(월)학생(직접 인터넷 신청)마이크로디그리는취소 신청, 승인절차 없음취소자 명단 제출2025. 1. 8.(수)까지대학, 융합전공   본부 학사과취소 승인2025. 1. 9.(목)본부 학사과   대학, 융합전공신청2025. 1. 15.(수) ~ 1. 17.(금)학생(직접 인터넷 신청) 신청자 사정 및 선발20",2024-12-25 23:38:44.0
생활복지학과,2025학년도 제1학기 휴학·복학 신청 기간 안내,https://welfare.jnu.ac.kr/bbs/welfare/1702/904220/artclView.do,2025학년도 제1학기 휴학 복학 신청 기간 안내 가. 휴학 신청 기간1) 일반휴학(등록): 2025. 2. 18.(화) ~ 4. 24.(목)2) 일반휴학(미등록): 2025. 2. 18.(화) ~ 2. 21.(금)나. 복학 신청 기간1) 조기복학: 2025. 1. 2.(목) ~ 2. 7.(금)2) 일반복학: 2025. 1. 2.(목) ~ 2. 21.(금),2024-12-25 23:35:20.0
생활복지학과,2024년 하반기 1차 도전장학(미래) 선발 계획 안내,https://welfare.jnu.ac.kr/bbs/welfare/1702/904218/artclView.do,"2024년 하반기 1차 도전장학(미래) 선발 계획 안내 1. 장학생 선발가. 자격: 2025년 2월 학사과정 졸업예정자로서 2025학년도 전기 우리 대학교 일반대학원에 진학하려는 자 (학.석사연계과정생도 지원 가능)※ 직전학기 성적 평균평점 2.5이상 (전남대학교 장학규정 제3조(장학생의 자격))나. 장학금: 인문사회계열 1,700천원, 자연예체능계열 2,300천원※ 단, 지원액은 가용예산 범위에 따라 다소 변동 가능함다. 제출서류대상제출 서류제출 기한제출처지원신청자◦ 도전장학(미래) 지원신청서[별지 제1호 서식] ※ 붙임 참조2",2024-12-25 22:32:09.0
생활복지학과,2024학년도 전기(2025년 2월) 학부 졸업(수료)대상자 유보 신청 안내,https://welfare.jnu.ac.kr/bbs/welfare/1702/904211/artclView.do,2024학년도 전기(2025년 2월) 학부 졸업(수료)대상자 유보 신청 안내  □ 졸업(수료) 유보 신청 및 유보비 납부 □가. 유보 신청 기간 : 2024. 12. 12.(목) ~ 2025. 1. 2.(목) 18:00까지 [추가 신청기간 없음]나. 유보 학과(부) 확인 기한: 2025. 1. 6.(월)다. 유보비 납부기간[고지서 발행] : 2025. 1. 8.(수) ~ 1. 10.(금) 16:00까지 [추가 납부기간 없음]※ 고지서 발행(학생 개별 출력): 포털 등록 학부졸업(수료)유보 고지서 출력,2024-12-25 20:52:20.0
생활복지학과,2024학년도 동계 계절학기 수강취소 기간 및 방법 안내,https://welfare.jnu.ac.kr/bbs/welfare/1702/902806/artclView.do,2024학년도 동계 계절학기 수강취소 기간 및 방법 안내 1. 수강 취소 기간 및 방법구분수강취소 기간환불 금액취소 방법개강 전수강취소2024. 12. 19.(목) 09:00～2024. 12. 20.(금) 18:00전액학생포털을 이용하여 학생 본인이 직접 전산 취소개강 후수강취소2024. 12. 26.(목) 09:00~ 2025. 1. 2.(목) 18:00수강료의 2/3환불2025. 1. 3.(금) 09:00～2025. 1. 6.(월) 18:00수강료의 1/2환불2025. 1. 6.(월) 18:00 이후 수강취소 및 환불 불가※,2024-12-13 13:12:19.0
생활복지학과,2025학년도 한국지도자육성장학재단 장학생 선발 안내,https://welfare.jnu.ac.kr/bbs/welfare/1702/902805/artclView.do,"2025학년도 한국지도자육성장학재단 장학생 선발 안내 가. 추천 인원: 학부재학생 2명(최종 선발인원은 아님, 재단에서 최종심사 후 확정)나. 장학 내용1) 장학 금액: 등록금전액+학업보조비(학기 당 100만원)2) 지급 기간: 2년(정규학기 4학기 이내, 계속지급요건 충족 시)다. 자격 요건1) 2025학년도 1학기 기준, 3학년 1학기 등록 예정인 대한민국 국적 보유자2) 매 정규학기 당 최소 12학점 이상 이수한 자3) 전체학기 백분위 성적이 85점/100점 이상인 자(동계 계절학기 제외)4) 학칙에 의한 징계사실(학사징계",2024-12-13 13:09:06.0
생활복지학과,[홍보] 굿네이버스 호남권역 신입직원 수시채용 공고,https://welfare.jnu.ac.kr/bbs/welfare/1702/902792/artclView.do,"[홍보] 굿네이버스 호남권역 신입직원 수시채용 공고굿네이버스는 1991년 한국에서 설립되어 국내, 북한 및 해외에서 굶주림 없는 세상, 더불어 사는 세상을 만들기 위해 전문사회복지사업과 국제개발협력사업을 활발히 수행하고 있는 글로벌 아동권리 전문 NGO입니다.굿네이버스에서는 아래와 같이  직원 채용을 진행하고자 합니다. 굿네이버스와 함께 세상을 위한 좋은 변화를 만들어 갈 준비된 인재들의 많은 지원 바랍니다.1. 채용개요  가. 채용인원 : 0명  나. 채용 예정일 : 2025년 1월 1일(수)  다. 근무지      1) 굿네이버",2024-12-13 10:47:38.0
생활복지학과,[홍보] 광주동구정신건강복지센터 동계 방학 실습 모집 안내,https://welfare.jnu.ac.kr/bbs/welfare/1702/902791/artclView.do,"[홍보] 광주동구정신건강복지센터 동계 방학 실습 모집 안내가. 모집기간 : ~ 2025년 12월 27일 접수 마감(사전 전화문의 요망)나. 모집인원 : 4명다. 실습기간 : 2025년 01월 01일 ~ 2025년 02월 29일※ 상기 기간 중, 개별상담 후 일정 조정합니다. 라. 신청방법 :  전화, 이메일을 통한 사전 접수 및 실습의뢰(학생신상명세서)공문※ 전 화 : (062)233-0468 ※ 이메일 : hmt0468@hanmail.net마. 실습대상 : - 사회복지(사회사업)학과 대학생(3, 4학년) - 정신건강론, 정신건강사",2024-12-13 10:47:02.0
생활복지학과,[홍보] 광주 희망원 동계 사회복지현장실습생 모집,https://welfare.jnu.ac.kr/bbs/welfare/1702/902789/artclView.do,"[홍보] 광주 희망원 동계 사회복지현장실습생 모집가. 모집기간 : 2024년 12월 10일부터 ~ 12월 20일까지나. 모집인원 : 0명다. 실습기간 : 2025년 1월 10일 ~ 2월 10일 (4주간), 세부일정 협의 가능라. 신청방법 : 실습신청서, 실습생 프로파일 작성 후 방문 및 우편접수마. 실습내용 : 노숙인복지사업의 이해, 사례관리, 프로그램 계획 및 진행 등 현장실천 방법 등바. 실습비 : 10만원 (중식비 별도)",2024-12-13 10:45:40.0
생활복지학과,2024학년도 2학기 (2025년 2월) 졸업예정자 졸업시험 결과 안내,https://welfare.jnu.ac.kr/bbs/welfare/1702/902364/artclView.do,2024-2 (2025년 2월) 졸업예정자 졸업시험 결과 안내 학번합격 여부학번합격 여부212048합격212134합격190322합격214625합격193398합격191233합격210106합격193267합격214973합격193253합격214666합격212800합격200226합격200324불합격214653합격211261합격214589합격193251합격212242합격190646합격214608합격214982합격215186합격193605합격210036합격210283합격183402합격195455합격200062합격190214합격214704합격2,2024-12-10 13:55:01.0
생활복지학과,2024학년도 2학기 응원장학생 선발 안내,https://welfare.jnu.ac.kr/bbs/welfare/1702/902234/artclView.do,"2024학년도 2학기 응원장학생 선발 안내 가. 지원대상: 학부 재학생 중 가계곤란 등의 사유로 등록금 지원이 필요한 자1) 소득분위 0~1분위: 국가장학금, 법정장학(국가유공 및 북한이탈), 복지장학 등 지원 자격 미달*로 인해 장학금 지원을 받지 못한 경우* 성적 및 이수학점 조건 미충족, 국가장학금 수혜횟수(8회) 초과자, 국장 신청기간 미준수 등2) 최근 1년 이내 부모의 폐업, 실직 등으로 인한 긴급 가계곤란 사유가 발생한 경우나. 지원규모: 가계곤란 정도에 따라 예산 범위 내에서 차등 지원가계곤란 정도장학명장학금액비 고",2024-12-10 09:20:11.0
생활복지학과,[홍보] 광주북구중독관리통합지원센터 제46기 대학생 중독상담사 초급과정 모집 안내,https://welfare.jnu.ac.kr/bbs/welfare/1702/901677/artclView.do,[홍보] 광주북구중독관리통합지원센터 제46기 대학생 중독상담사 초급과정 모집 안내 가. 교 육 명: 제46기 대학생을 위한 중독 상담사 초급과정 나. 일 시: 2024. 12. 26.(목) ~ 2024. 12. 27.(금) 09:20 ~ 17:30 다. 장 소: 광주북구중독관리통합지원센터 3층 교육실 라. 교육내용: 중독 관련 기본이론 및 실무관련 교육 마. 접수기간: 2024. 12. 2.(월)00:00부터 ~ 2024. 12. 11.(수)13:00까지 바. 인 원: 30명(한 학교의 학과별로 5명 선착순 마감) 사. 문 의: 0,2024-12-02 16:16:49.0
생활복지학과,[홍보] 엠마우스복지관 2024 동계 사회복지현장실습생 모집,https://welfare.jnu.ac.kr/bbs/welfare/1702/901676/artclView.do,"[홍보] 엠마우스복지관 2024 동계 사회복지현장실습생 모집 가. 모집기간 : 2024년 11월 25일(월) ~ 2024년 12월 06일(금) 나. 모집인원 : 5명(한 학교당 최대 2명) 다. 실습기간 : 2025년 01월 15일(수) ~ 2025년 02월 14일(금) : 160시간 라. 실습내용 : 발달장애인의 이해, 사람중심계획(PCP) 진행 과정 및 전략, 생애주기별 서비스 지원체계, 프로그램 작성 및 진행 등 마. 접수방법 : 학과실을 경유하여 공문으로 접수 또는 개별 접수  (별첨한 신청서, 프로파일, 개인정보동의서 작성",2024-12-02 16:16:00.0
생활복지학과,[홍보] 제10회 장기려봉사상 청소년대학생 자원봉사 체험수기 발표대회,https://welfare.jnu.ac.kr/bbs/welfare/1702/901492/artclView.do,"[홍보] 제10회 장기려봉사상 청소년대학생 자원봉사 체험수기 발표대회- 대회명 : 제10회 장기려봉사상 청소년 대학생 자원봉사 체험수기 발표대회(장기려봉사대회)- 응모자격 : 중고등학생(청소년), 대학생(휴학생 포함) 혹은 이에 준하는 개인 및 동아리(과거 본 대회의 동상 이상 수상자는 3년 이내 응모 불가)- 응모기간 : 2024년 10월 15일(화)~12월 10일(화) 자정까지- 본선대회 일시 : 2024년 12월 28일(토) 14:00~18:00- 본선대회 장소 : 국회의원회관 제3세미나실 (예정)- 시상내역 : 국회의장상,",2024-11-29 13:10:25.0
생활복지학과,[홍보] 2025년 굿네이버스 전남북부지부(전남북부권아동보호전문기관) 동계 사회복지 현장실습생 모집,https://welfare.jnu.ac.kr/bbs/welfare/1702/901491/artclView.do,"[홍보] 2025년 굿네이버스 전남북부지부(전남북부권아동보호전문기관) 동계 사회복지 현장실습생 모집 가. 모집기간 :  2024년 11월 25일 (월) ~ 2024년 12월 06일 (금) 18:00 까지 나. 모집인원 : 00명 다. 실습기간 : 2025년 01월 13일 (월) ~ 2025년 2월 12일 (수) / 총 4주, 160시간 *설날 연휴 발생에 따른 실습일 3일(24시간) 추가 진행 라. 실습내용 :  법인 및 기관의 이해, 아동학대예방사업, 심리치료, 펀드레이징 등 마. 접수방법 :  지부 홈페이지(http://jnbb",2024-11-29 13:09:32.0
생활복지학과,[홍보] 굿네이버스 전남중부지부 2024 동계 사회복지현장실습생 모집,https://welfare.jnu.ac.kr/bbs/welfare/1702/901490/artclView.do,"[홍보] 굿네이버스 전남중부지부 2024 동계 사회복지현장실습생 모집가. 모집기간 : 2024년 11월 25일(월)~2024년 12월 13일(금)나. 모집대상 : 사회복지현장실습 참여자 2~5명다. 실습기간 : 2025년 1월 13일(월)~2025년 2월 12일(수) / 20일(160시간)라. 실습장소 : 사회복지법인 굿네이버스 전남중부지부(나주시 송월3길 28, 4층)마. 접수방법 : 기관 이메일 접수(jeonnamjoongbu@gnk.or.kr)바. 실 습 비 : 10만원(식비별도)※ 문의 : 061-332-1391 김보람 대리",2024-11-29 13:08:01.0
생활복지학과,2024학년도 전남대 학생 후생복지시설 만족도 조사 실시 안내,https://welfare.jnu.ac.kr/bbs/welfare/1702/901140/artclView.do,"2024학년도 전남대 학생 후생복지시설 만족도 조사 실시 안내 가. 조사기간: 2024. 11. 25.(월) ~ 12. 6.(금)나. 조사대상: 전남대학교 소속 교직원 및 학생다. 조사내용: 전남대 후생복지시설(구내식당, 카페, 편의점, 문구점) 이용자 만족도라. 참여방법: 온라인 설문조사 참여 또는 전남대 홈페이지 공지사항마. 참여주소: https://forms.gle/84BhTQE76S8HTikAA",2024-11-25 14:33:29.0
생활복지학과,관정이종환교육재단 2025학년도 국내대학 장학생 선발 안내,https://welfare.jnu.ac.kr/bbs/welfare/1702/900273/artclView.do,"가. 추천인원: 학부재학생 5명 내외(최종 선발인원은 아니며, 3차 선발과정을 거쳐 최종 확정) - 계열별 추천인원 비율: 자연 이공계열 80%, 인문 사회계열 20%나. 장학금액: 학기당 최대 600만원[재단 제반규정에 저촉되지 않는 한 최대 4학기 지원]다. 지원자격- 대한민국 국적 보유자로서 대한민국에서 고등학교를 졸업한 자- 2025학년도 1학기에 5학기(3학년 1학기) 진학 예정인 자  - 학부 1 3학기 총 평균평점이 4.0/4.5만점 이상인 자  - 만 24세 이하(2025년 기준 2001.1.1이후 출생한 자)  ※",2024-11-15 11:23:25.0
생활복지학과,[홍보] 나주시노인복지관 2024 동계 사회복지현장실습생 모집,https://welfare.jnu.ac.kr/bbs/welfare/1702/899796/artclView.do,"[홍보] 나주시노인복지관 2024 동계 사회복지현장실습생 모집1. 모집기간 : 2024. 10. 31.(목)~ 2024. 11.15.(금)까지2. 대 상 : 사회복지 및 관련학과 재학생3. 모집인원 : 5명4. 지원방법 - 이메일(nj7726@hanmail.net), 우편 (전남 나주시 예향로 3874), 방문- 서류 제출시 메일 제목, 봉투 표지  2025년 동계 사회복지현장실습 지원신청서 재증  기재5. 제출서류 : 실습신청서, 실습생 프로파일, 개인정보동의서6. 실습 기간 : 2025. 1. 6.(월) ~ 2024. 2. 5.",2024-11-08 10:29:43.0
