학부,제목,링크,내용,작성일
역사교육과,2020학년도 우수학생 국가장학금(인문100년) 학생 사전신청 안내,https://hisedu.jnu.ac.kr/bbs/hisedu/2296/784145/artclView.do,"2020학년도 우수학생 국가장학금(인문100년, 예술체육비전) 신규 장학생 선발을 위한 학생 사전신청을 안내하오니 해당 학생들은 참고해주시기 바랍니다.?xml:namespace prefix = ""o"" ns = ""urn:schemas-microsoft-com:office:office"" /   가. 신청대상    - 대한민국 국적 소지자로서 인문사회계열 또는 예술 및 체육계열 학과(부) 재학생        · 인문 100년 및 예술체육비전 장학금: 해당 계열 1학년(전공탐색유형(4년지원)) 또는 3학년(전공확립유형(2년 지원))",2020-04-02 00:00:00.0
역사교육과,2020학년도 1학기 예비 해외파견 교육 시행 알림,https://hisedu.jnu.ac.kr/bbs/hisedu/2296/784143/artclView.do,"국제교류 프로그램 예비 참여자의 외국어 능력 및 글로벌 역량 강화를 위해 2020학년도 1학기 예비 해외파견 교육 프로그램 참여자를 아래와 같이 모집한다 하오니 관심있는 학생들은 참고해주시기 바랍니다.?xml:namespace prefix = ""o"" ns = ""urn:schemas-microsoft-com:office:office"" /     가. 지원기간: 2020. 3. 20.(금) ~ 2020. 3. 31.(화), 오후 6시    나. 지원자격: 1학년 1학기(첫학기)~3학년 1학기(5학기)를 재학 중이며 평균 평점 3.0",2020-03-25 00:00:00.0
역사교육과,2020학년도 제1학기 추가 2차 등록기간 안내,https://hisedu.jnu.ac.kr/bbs/hisedu/2296/784142/artclView.do,"공    고  우리 대학교에서는 2020. 3. 17.(화) ~ 3. 19.(목) 추가 등록을 실시하였으나 아직까지 등록금을 납부하지 못한 학생이 있어 다음과 같이 추가 2차 등록기간을 설정, 시행하오니 기간내에 등록금을 납부하시기 바랍니다. ■  다      음  ■?xml:namespace prefix = ""o"" ns = ""urn:schemas-microsoft-com:office:office"" / 1. 기    간 : 2020. 3. 31.(화) ~ 4. 2.(목) 16:00 [3일간]   ➣ 2020. 1학기 수업연한 초과자",2020-03-24 00:00:00.0
역사교육과,2020학년도 1학기 수강취소 안내,https://hisedu.jnu.ac.kr/bbs/hisedu/2296/784141/artclView.do,2020학년도 제1학기 수강취소 안내 ❍ 신청기간: 2020. 4. 9.(목) 09:00 ~ 4. 10.(금) 17:00 ❍ 취소절차: 학생이 인터넷으로 포털에서 직접 수강취소 신청→교과목 개설학과에서                 취소 승인 ❍ 취소방법: 전남대학교 포털사이트(http://portal.jnu.ac.kr)에 접속한 후 “교육지원→                내 학사행정→수업→수강신청→수강취소 신청” 선택 ❍ 수강취소 과목범위   - 수강취소 신청과목은 2과목 이내로 하되 취소 후 수강학점은 1학점 이상을 유지해,2020-03-23 00:00:00.0
역사교육과,2020학년도 하계 계절학기 개설교과목 수요조사 실시 안내,https://hisedu.jnu.ac.kr/bbs/hisedu/2296/784140/artclView.do,"우리 대학 학생을 대상으로 2020학년도 하계 계절학기 개설교과목에 대한 수요조사를 다음과 같이 실시하오니, 재학생들은 참고해주시기 바랍니다.    가. 신청기간: '20. 3. 17.(화) ~ 3. 25(수)   나. 신청대상: 계절학기 수강을 희망하는 학생   다. 신청방법: 전남대학교 포털(http://portal.jnu.ac.kr) 로그인→교육지원→내 학사행정→수업→계절학기→계절수업 개설과목 수요조사   라. 기타: 2과목까지 수요조사 신청 가능 ?xml:namespace prefix = ""o"" ns = ""urn:sch",2020-03-17 00:00:00.0
역사교육과,2020학년도 1학기 교과구분 정정 실시 안내,https://hisedu.jnu.ac.kr/bbs/hisedu/2296/784139/artclView.do,"휴·복학에 따른 교육과정 적용년도 변경, 부·복수전공 선발, 모집단위간이동(전과) 및 국내·외 타대학 교류로 인한 교과구분 상이 학생에 대하여 다음과 같이 교과구분 정정을 실시하오니, 교과구분 정정 신청자는 신청서를 2020. 4. 3.(금)까지 제출하여 주시기 바랍니다.    가. 주요 확인 및 유의사항    1) 휴·복학 및 전과에 따른 교육과정 적용년도 변경자의 경우, 적용받는 교육과정에 따    라 필수 과목이 달라질 수 있으므로 교육과정 적용년도 반드시 확인    2) 편입생 전적 대학 학점인정 내역은 교과구분 정정",2020-03-17 00:00:00.0
역사교육과,졸업자 및 제적자 중 신입학 학생 학점인정 신청 안내,https://hisedu.jnu.ac.kr/bbs/hisedu/2296/784138/artclView.do,"우리 대학 졸업자 및 제적자 중 신입학 학생은 기 취득학점을 인정받아 1년 범위 내에서 수업연한을 단축(의학과, 치의학과, 수의학과, 약학부 제외)할 수 있는 바, 학점인정을 희망하는 학생이 있는 경우 신청서를 2020. 4. 10.(금)까지 학과사무실로 제출하여 주시기 바랍니다.?xml:namespace prefix = ""o"" ns = ""urn:schemas-microsoft-com:office:office"" /   가. 학점인정 범위    1) 신입학 학생이 원하는 교과목을 인정하되 교양, 전공, 일선으로 구분하여 학칙 제",2020-03-10 00:00:00.0
역사교육과,20학년도 1학기 국가장학금 2차 신청기간 연장 안내(~3월 23일까지),https://hisedu.jnu.ac.kr/bbs/hisedu/2296/784137/artclView.do,"코로나 19로 인한 개강 연기로 국가장학금 신청을 놓치는 학생들이 없도록, 교육부에서2020학년도 1학기 국가장학금 2차 신청기간을 연장하였으니, 해당 학생들은 참고해주시기 바랍니다.   가. 신청 대상: 신입생, 편입생, 재입학생, 복학생 및 1차 미신청 재학생*         * 재학생은 국가장학금 1차 신청이 원칙이나, 2차 신청 후 구제신청서 제출(공인인증서       서명) 시 재학 중 2회에 한하여 심사 후 지원 가능       ※ 코로나 19로 인해 해외에서 학업 등을 포기하거나 입영 연기로 복학한 재학생 등은 증",2020-03-09 00:00:00.0
역사교육과,2020학년도 학생증(스마트카드) 대학별 배부일정 안내,https://hisedu.jnu.ac.kr/bbs/hisedu/2296/784136/artclView.do,"2020학년도 학생증(스마트카드) 대학별 배부일정 1. 배부대상: 전남대포털에서 학생증 발급 신청을 완료한 신(편)입생2. 수령방법: 직접 방문 수령(신분증 지참)?xml:namespace prefix = ""o"" ns = ""urn:schemas-microsoft-com:office:office"" / 배부일 및 시간대   학(원)배부 장소2020. 3. 18.(수) ~ 3. 27.(금) 10:00~16:30학생증 조기수령 희망학생제1학생회관 1층 광주은행2020. 3. 30.(월) 10:00~16:30간호대학, 의과대학, 수의과대학,",2020-03-06 00:00:00.0
역사교육과,2020학년도 1학기 국가장학금 2차 신청 재안내,https://hisedu.jnu.ac.kr/bbs/hisedu/2296/784135/artclView.do,"2020학년도 1학기 국가장학금 2차 신청 일정을 다음과 같이 재안내하오니 코로나 19로 인하여 개강이 연기된 상황 등을 고려하여 재학생 및 신입생들의 국가장학금 미신청자가 발생하지 않도록 참고해주시기 바랍니다.    2020년 1학기 국가장학금 2차 신청 안내   1. 신청대상 : 신·편입생, 복학생, 1차 미신청 재학생*   * 구제신청서를 제출한 경우에 한해, 재학생 2차 신청 가능(재학 중 2회)   ※ 코로나 19로 인해 해외 및 국내에서 학업 등을 포기한 재학생 등은 증빙자료 제출 시 2차 신청기간 신청 허용 (구제",2020-03-06 00:00:00.0
역사교육과,2020학년도 1학기 등록금 반환 기준 변경 안내,https://hisedu.jnu.ac.kr/bbs/hisedu/2296/784134/artclView.do,"코로나바이러스감염증-19 확산을 방지하고 학생들의 안전한 교육환경 조성을 위하여 ’20. 1학기 개강일이 2주 연기됨에 따라 등록금 반환 기준을 아래와 같이 변경하여 시행하오니, 참고해주시기 바랍니다.   가. 2020학년도 1학기 등록금 반환 기준 변경 주요내용   - 반환사유 기준일 변경(학기개시일 → 개강일)반환금액반환사유 발생일비고변경 전(학기 개시일/’20. 3. 1.)변경 후(개강일/’20. 3. 16.)?xml:namespace prefix = ""o"" ns = ""urn:schemas-microsoft-com:off",2020-03-03 00:00:00.0
역사교육과,2020학년도 제1학기 추가 등록기간 안내,https://hisedu.jnu.ac.kr/bbs/hisedu/2296/784133/artclView.do,"2020학년도 제1학기 등록기간(2020. 2. 24.~2. 27.)내에 등록금을 납부하지 못한 학생과 학자금 대출을 신청한 학생을 위하여 다음과 같이 추가 등록기간을 설정하오니 해당학생들은 참고해주시기 바랍니다.?xml:namespace prefix = ""o"" ns = ""urn:schemas-microsoft-com:office:office"" /    가. 기간: 2020. 3. 17.(화) ~ 3. 19.(목) 16:00 [3일간]   나. 등록장소: 광주은행 및 농협 전국 본·지점(지역농협 포함)   다. 유의사항",2020-03-02 00:00:00.0
역사교육과,2020학년도 제1학기 수강신청 변경 안내,https://hisedu.jnu.ac.kr/bbs/hisedu/2296/784132/artclView.do,"코로나19 감염증 확산을 방지하고 학생들의 안전한 교육환경 조성을 위하여 2020학년도 제1학기 수강신청 일정을 아래와 같이 변경(조정)하여 시행하오니, 재학생들은 참고해주시기 바랍니다. 업무내용기간(당초)기간(변경)시간대상내용수강인원 조정‘20.1.30.(목) ~2.4.(화)변동없음09:00～18:00(완료) 전공: 강좌 주관학과 교양: 강좌 협력학과 강좌일람 합반처리 학년별 수강인원 관리 자과/타과/부전공 수강인원 조정 분반정보의 사무실 번호 확인수강희망과목예약 신청'20.2.6.(목)~2.7.(금)변동없음09:0",2020-02-19 00:00:00.0
역사교육과,[채용안내] 월광기독교학교 기간제 채용 안내,https://hisedu.jnu.ac.kr/bbs/hisedu/2296/784131/artclView.do,"월광기독교학교에서 다음과 같이 기간제를 채용한다 하오니 관심있는 분들은 참고해주시기 바랍니다. (자세한 사항은 첨부파일 확인) 1. 채용   가. 채용 권자: 월광기독학교장   나. 채용 절차: 공개 채용   다. 채용 분야 및 채용 예정 인원, 응시 자격과 목모집인원(명)채용 예정 기간응시 자격사회(역사)(중·고등)1〃중등 사회(역사) 교원자격증 소지자(단, 역사 소지자의 경우 사회 수업 가능자) 2020년 2월말 이내 취득예정자고등학교 인문계 교육과정 지도 가능자계1?xml:namespace prefix = ""o"" ns",2020-02-14 00:00:00.0
역사교육과,2020년 전라남도 기간제교사 인력풀제 시행 안내,https://hisedu.jnu.ac.kr/bbs/hisedu/2296/784130/artclView.do,기간제교사의 원활한 채용과 학교업무정상화를 위한 [2020년 2차 기간제교사 인력풀제 시행 공고]를 다음과 같이 시행한다 하오니 관심있는 분들은 참고해주시기 바랍니다.   가. 등록 대상  1) 미등록자: 전라남도교육청 기간제교사 인력풀에 등록되어 있지 않은 자 중 희망자  2) 추가등록자: 2018~2019년 등록자 중 복수 자격 및 부전공 과목 추가 등록 희망자     3) 재등록자: 2017년 전라남도교육청 기간제교사 인력풀 등록자 중 희망자         ※2017년 등록자는 3년의 유효기간이 만료되므로 2020. 9월,2020-02-13 00:00:00.0
역사교육과,[채용안내] 2020년 상반기 기간제교원 채용안내(고흥),https://hisedu.jnu.ac.kr/bbs/hisedu/2296/784129/artclView.do,전라남도 고흥교육청에서 2020년 상반기기간제교사를 채용한다 하오니 관심있는 분들은 붙임문서 확인해 주시기 바랍니다.  붙임 1. 2020. 상반기 기간제교원 채용시험 계획 공고문 1부. 끝,2020-02-13 00:00:00.0
역사교육과,2020학년도 1학기 국가장학금 2차 신청 안내,https://hisedu.jnu.ac.kr/bbs/hisedu/2296/784128/artclView.do,"2020학년도 1학기 국가장학금 2차 신청 일정을 다음과 같이 안내하오니 각 대학에서는 학생들이 국가장학금을 신청할 수 있도록 적극 안내하여 주시고, 대외협력과에서는 대학 홈페이지 및 IPTV 등을 통한 홍보물 제작 게시에 협조하여 주시기 바랍니다.   가. 신청 기간: 2020. 2. 3.(월) ~ 3. 10.(화) 18:00 (총 37일간)        - 서류제출 및 가구원 정보제공 동의 기간: 2020. 2. 3.(월) ~ 3. 12.(목) 18:00         ※ 토․일요일, 공휴일 포함 24시간 신청 가능, 마지",2020-02-04 00:00:00.0
역사교육과,2019학년도 하반기 도전장학(미래) 추가선발 계획 안내,https://hisedu.jnu.ac.kr/bbs/hisedu/2296/784127/artclView.do,"『2019학년도 하반기 도전장학(미래) 추가선발 계획』을 다음과 같이 안내하오니 해당학생들은 참고해주시기 바랍니다.   가. 장학생 선발     o 자격: 2020년 2월 학사과정 졸업예정자로서 2020학년도 전기 우리대학교 일반대학원에 진학하려는 자(학·석사연계과정생 지원 가능)                   ※ 직전학기 성적 평균평점 2.5 이상     o 장학금: 인문사회계열 1,700천원, 자연예체능계열 2,300천원     o 제출서류     o 제출서류대상제출 서류제출 기한제출처지원신청자◦ 도전장학(미래) 지원신청",2020-01-31 00:00:00.0
역사교육과,2020학년도 1학기 서해안권 거점국립대 개설 공동화상강의 교과목 수학 추천 안내,https://hisedu.jnu.ac.kr/bbs/hisedu/2296/784126/artclView.do,"서해안권 거점국립대학 공동화상강의 운영에 따라 2020학년도 1학기 전북대, 충남대에서 운영    예정인 공동화상강의 교과목을 아래와 같이 안내합니다 신청자가 있을 경우 붙임 수학신청원을 2020. 1. 31.(금)까지 학과사무실로 제출하여 주시기 바랍니다.      서해안권 거점국립대학 공동화상강의 ○ 목적: 서해안권 거점국립대학(전남대, 전북대, 충남대)별 강점 분야 원격 강의 자원 공유를 통해              타대학의 수준높은 강의 수강     ※ 우리대학 교과목 수강하면서 전북대, 충남대 개설 교과목 수강 가능",2020-01-21 00:00:00.0
역사교육과,2020학년도 2학기(~2021학년도 1학기) 해외 파견 교환학생 선발 안내,https://hisedu.jnu.ac.kr/bbs/hisedu/2296/784125/artclView.do,"2020학년도 2학기(~2021학년도 1학기) 해외 파견 교환학생을 아래와 같이 선발한다 하오니 관심있는 재학생들은 참고해주시기 바랍니다.?xml:namespace prefix = ""o"" ns = ""urn:schemas-microsoft-com:office:office"" /   1. 파견대학 및 선발인원: 37개국 107개교 216명  2. 파견기간: 2020년 8월 ~ 2021년 1월 중 (한 학기 또는 1년 파견)  3. 추진일정      가. 모집공고 및 신청서 접수: ‘20. 1. 20.(월) ~ 1. 31.(금) 오후",2020-01-20 00:00:00.0
역사교육과,"2020학년도 1학기 동국대(학부,대학원) 교류추천 안내",https://hisedu.jnu.ac.kr/bbs/hisedu/2296/784124/artclView.do,2020학년도 1학기 타 대학교 운영계획을 다음과 같이 안내하오니 신청자가 있을 경우 붙임 수학신청원을   해당 추천기한까지 학과사무실로 제출해 주시기 바랍니다.    가. 지원자격      1) 재학생에 한함(2020.1학기 복학예정자는 복학승인 후 신청)      2) 기 이수학기의 평균평점이 3.0이상인 자(대학원생은 3.5이상)      3) 학칙에 의거 징계받은 사실이 없는 자      4) 타 대학 교류학생으로 수학한 기간이 2학기(1년)를 초과하지 않는 자(계절학기 별도)   나. 교류 내용(기타 자세한 사항은 붙,2020-01-20 00:00:00.0
역사교육과,"2020학년도 1학기 서울시립대(학부,대학원) 교류추천 안",https://hisedu.jnu.ac.kr/bbs/hisedu/2296/784123/artclView.do,2020학년도 1학기 타 대학교 운영계획을 다음과 같이 안내하오니신청자가 있을 경우 붙임 수학신청원을 해당 추천기한까지 학과사무실로 제출해 주시기 바랍니다.   가. 지원자격       1) 재학생에 한함(2020.1학기 복학예정자는 복학승인 후 신청)       2) 기 이수학기의 평균평점이 3.0이상인 자(대학원생은 3.5이상)       3) 학칙에 의거 징계받은 사실이 없는 자       4) 타 대학 교류학생으로 수학한 기간이 2학기(1년)를 초과하지 않는 자(계절학기 별도)   나. 교류 내용(기타 자세한 사항은 붙,2020-01-20 00:00:00.0
역사교육과,"2020학년도 1학기 조선대, 목포대 교류학생 추천 안내",https://hisedu.jnu.ac.kr/bbs/hisedu/2296/784122/artclView.do,2020학년도 1학기 타 대학교 운영계획을 다음과 같이 안내하오니 신청자가 있을 경우 붙임 수학신청원을 해당 추천기한까지 학과사무실로 제출해 주시기 바랍니다.    가. 지원자격       1) 재학생에 한함(2020.1학기 복학예정자는 복학승인 후 신청)       2) 기 이수학기의 평균평점이 3.0이상인 자(대학원생은 3.5이상)       3) 학칙에 의거 징계받은 사실이 없는 자       4) 타 대학 교류학생으로 수학한 기간이 2학기(1년)를 초과하지 않는 자(계절학기 별도)   나. 교류 내용(기타 자세한 사항은,2020-01-20 00:00:00.0
역사교육과,2020학년도 1학기 고려대 교류학생 추천 안내,https://hisedu.jnu.ac.kr/bbs/hisedu/2296/784121/artclView.do,2020학년도 1학기 타 대학교 운영계획을 다음과 같이 안내하오니 신청자가 있을 경우 수학신청원을   해당 추천기한까지 학과사무실로 제출해 주시기 바랍니다.    가. 지원자격      1) 재학생에 한함(2020.1학기 복학예정자는 복학승인 후 신청)      2) 기 이수학기의 평균평점이 3.0이상인 자(대학원생은 3.5이상)      3) 학칙에 의거 징계받은 사실이 없는 자      4) 타 대학 교류학생으로 수학한 기간이 2학기(1년)를 초과하지 않는 자(계절학기 별도)   나. 교류 내용(기타 자세한 사항은 붙임 파,2020-01-20 00:00:00.0
역사교육과,2020학년도 1학기 한국장학재단 농촌출신대학생 학자금융자사업 시행 안내,https://hisedu.jnu.ac.kr/bbs/hisedu/2296/784120/artclView.do,"한국장학재단에서 농어업인 교육비 부담 경감 및 농어촌출신 대학생에 대한 균등한 교육기회 제공을 위하여 「2020학년도 1학기 농촌출신대학생 학자금지원사업」을 아래와 같이 시행한다 하오니 해당학생들은 참고해주시기 바랍니다.?xml:namespace prefix = ""o"" ns = ""urn:schemas-microsoft-com:office:office"" /   가. 주요 일정구 분1차(재학생 및 신입생군*)2차(신입생군*만 해당비고신청 및 서류제출2020. 1. 02.(목) ~ 1. 10.(금)2020. 2. 10.(월) ~ 2",2020-01-06 00:00:00.0
역사교육과,2020년 꿈사다리 공부방 사업 청년학습선생님 채용 공모 안내,https://hisedu.jnu.ac.kr/bbs/hisedu/2296/784119/artclView.do,"전라남도에서는 지역아동센터 이용 아동의 학력증진과 청년일자리 창출을 위해 「꿈사다리 공부방」 사업을 추진하고 있습니다. 「꿈사다리 공부방」은 고학력·미취업 청년을 지역아동센터에 학습 선생님으로 배치하여 아이들의 학습을 지도·보강하으로써, 아이들에게는 학습능력 향상의 기회를 주고 청년들에게는 일자리를 제공하는 사업입니다.   이에 ‘전라남도 위탁 지역아동센터전남지원단’에서 다음과 같이 청년학습선생님을 공개모집을 알려온 바, 관심있는 분들은 참고해주시기 바랍니다.?xml:namespace prefix = ""o"" ns = ""urn:",2020-01-06 00:00:00.0
역사교육과,2020학년도 1학기 교직 '응급처치 및 심폐소생술 실습' 실시 안내,https://hisedu.jnu.ac.kr/bbs/hisedu/2296/784118/artclView.do,"우리 대학 교직이수 중인 학생들에게 「응급처치 및 심폐소생술 실습」을 시행하고자 하오니, 해당 학생들은 참고해주시기 바랍니다. ?xml:namespace prefix = ""o"" ns = ""urn:schemas-microsoft-com:office:office"" /  가. 실습 대상: 비사범대학, 사범대학, 교육대학원 교직이수자 재학생, 수료생 및 졸업유보생  나. 실습 횟수: 교원양성과정을 이수하는 동안 2회 이상                  (2016학년도 입학생부터 실습 횟수의 인정은 학기별 1회를 기본원칙으로 함.)",2020-01-06 00:00:00.0
역사교육과,[수강신청] 2020학년도 제1학기 수강신청 안내,https://hisedu.jnu.ac.kr/bbs/hisedu/2296/784117/artclView.do,2020학년도 수강신청 시행계획을 다음과 같이 알려드리니 재학생들은 참고해주시기 바랍니다. (수강신청 기간이 변경되었음) 업무내용기간시간대상내용수강인원 조정‘20.1.30.(목) ~2.4.(화)09:00～18:00 전공: 강좌 주관학과 교양: 강좌 협력학과 강좌일람 합반처리 학년별 수강인원 관리 자과/타과/부전공 수강인원 조정 분반정보의 사무실 번호 확인수강희망과목예약 신청'20.2.6.(목)~2.7.(금)09:00～18:00 학부 전 학년 공통 학부생만 해당(대학원생 제외) 수강희망과목 예약을 했더라도 수강신,2020-01-03 00:00:00.0
역사교육과,2020년 1학기 농어촌희망재단 장학금 지원사업 장학생 선발 안내,https://hisedu.jnu.ac.kr/bbs/hisedu/2296/784116/artclView.do,"2020년 1학기 농림축산식품부 장학금 지원사업(청년창업농육성장학금, 농식품인재장학금,    농업자녀장학금) 장학생 선발공고를 붙임과 같이 안내하오니 재학생들은 참고해주시기 바랍니다.   가. 신청기간: 2019. 12. 19.(목) ~ 2020. 1. 7.(화) 17:00까지  나. 신청방법: 농어촌희망재단 홈페이(www.rhof.or.kr)에서 온라인 신청  다. 결과발표: 2020. 2. 11.(화) 예정(온라인사이트 확인)     ☞ 자세한 내용은 선발안내를 참고 바람 붙임  선발공고문 1부.  끝.",2020-01-02 00:00:00.0
역사교육과,2020학년도 1학기 등록 안내,https://hisedu.jnu.ac.kr/bbs/hisedu/2296/784114/artclView.do,"2020학년도 제1학기 등록 공고?xml:namespace prefix = ""o"" ns = ""urn:schemas-microsoft-com:office:office"" /    2020학년도 제1학기 등록금 납부를 다음과 같이 공고하오니 등록에 차질 없으시기 바랍니다. 1. 기 간: 2020. 2. 24.(월) ~ 2. 27.(목) 16:00까지 [4일간] 2. 장 소: 광주은행 및 농협 전국 본·지점(지역농협 포함) 3. 등록금 분할납부 방법    가. 신청대상: 경제사정으로 정해진 기간내에 등록금 전액 납부가 어려워 분할납부하고",2019-12-24 00:00:00.0
역사교육과,2019학년도 제2학기 글로벌커뮤니케이션잉글리쉬 시험 개인별 점수 조회방법 안내,https://hisedu.jnu.ac.kr/bbs/hisedu/2296/784113/artclView.do,"지난 11월에 실시한 2019학년도 제2학기 글로벌커뮤니케이션잉글리쉬    시험의 개인별 점수 조회방법을 알려드리니 재학생들은 참고해주시기 바랍니다.?xml:namespace prefix = ""o"" ns = ""urn:schemas-microsoft-com:office:office"" / ■ 성적 조회 방법: 전남대 포털 → 로그인 → 교육지원 →내학사행정 →성적 →                        이수성적 → 글로벌커뮤니케이션잉글리쉬 성적조회 클릭 붙임: 글로벌커뮤니케이션잉글리쉬 교과목 성적 조회 안내 1부.  끝",2019-12-20 00:00:00.0
역사교육과,[장학안내] 2020학년도 1학기 재학생 신규 국가유공자(자녀 포함) 및 가족장학금 신청 안내,https://hisedu.jnu.ac.kr/bbs/hisedu/2296/784110/artclView.do,"2020학년도 1학기 재학생 신규 국가유공자(자녀 포함) 등 법정 장학 또는 가족장학 대상자를 우선 선발하여 장학금을 지급한다 하오니 해당학생들은 학과사무실로 신청바랍니다.   가. 장학 대상자 및 자격구분수혜자격증빙서류장학금비고재학생 신규 국가유공자 또는 그의 자녀 등 법정 장학 대상자독립유공자예우에 관한 법률 제15조제2항 해당자, 국가유공자 등 예우 및 지원에 관한 법률 제22조제1항 해당자, 5·18민주유공자예우에 관한 법률 제12조제1항 해당자 등 법정 장학대상자 중 직전 학기 평균평점이 1.75(실점 70점)이상인",2019-12-19 00:00:00.0
역사교육과,2020년도 한국지도자육성장학재단 신규 장학생 추천 안내,https://hisedu.jnu.ac.kr/bbs/hisedu/2296/784109/artclView.do,"한국지도자육성장학재단에서 다음 세대를 이끌어갈 우리사회의 참다운 지도자를 찾기 위하여    2020년도 신규 장학생들을 아래와 같이 선발한다 하오니 참고해주시기 바랍니다.?xml:namespace prefix = ""o"" ns = ""urn:schemas-microsoft-com:office:office"" /   가. 장학생 추천     1) 대학 추천인원: 2명     2) 추천대상: 2020년 3월 현재, 국내 4년제 대학 재학생으로 2개학기 이상 이수한 대한민국         국적 보유자     3) 자격요건: 교내·외 활동",2019-12-13 00:00:00.0
