학부,제목,링크,내용,작성일
역사교육과,[지원안내] 공인외국어시험 응시료 지원 안내,https://hisedu.jnu.ac.kr/bbs/hisedu/2296/783012/artclView.do,"공인외국어시험 응시료를 당초 3,4학년을 대상으로 지원하였으나 1,2학년도 포함하여 지원하고자 하오니 희망자는 신청하여 주시기 바랍니다. (단, 1.2학년 중 대학 모의토익 미응시자는 지원 불가)   ㅁ 응시료 지원 기간  : 2011. 3. 1. ~ 2012. 1. 31. 까지 응시 결과에 한하여 지원   ㅁ 지원 대상 및 순위 :      - 사범대학 3, 4학년 재학생 우선(1순위)     - 사범대학 2학년 재학생 우선(2순위) = 대학 모의토익 응시자     - 사범대학 2학년 재학생 우선(3순위) = 대학 모의토익 응시자",2011-10-20 00:00:00.0
역사교육과,2011년도 교직원 및 학생 성희롱·성매매예방 온라인 교육 실시 안내,https://hisedu.jnu.ac.kr/bbs/hisedu/2296/783009/artclView.do,"대학 및 각급학교를 포함한 모든 공공기관은 매년 1회 이상 성희롱.성매매예방교육을 의무 시행하도록 법에 규정되어 있는 바, 전남대는 이를 온라인 교육으로 시행한다고 합니다. 그러하오니 재학생들 전원은 필히 온라인 교육을 이수하시기 바랍니다.            가. 교육대상 : 교수, 조교, 시간강사, 직원, 학생(대학원생 포함)등 대학 전구성원            나. 온라인 교육 이수 방법                ★ 교직원, 학생 포털 →우측 하단 바로가기 서비스                               →",2011-10-14 00:00:00.0
역사교육과,[선발안내] 2011년 동계 국제인턴(개별인턴 포함) 선발안내,https://hisedu.jnu.ac.kr/bbs/hisedu/2296/783003/artclView.do,"2011년 동계 국제인턴 모집에 관하여 아래와 같이 안내하오니, 관심 있는 학생들은 필히 참고하시어 신청하시기 바랍니다.       가. 파견 기관 및 인원          - 본부주관: 미국 미주리대학 5명          - 개별인턴: 학생이 구직한 인턴기관 10명              나. 파견기간: 2011.12.19~2012.02.29 중 6주 내외       다. 파견인원: 15명 내외(미주리파견 5명, 개별인턴 10명 내외)       라. 대학지원금: 1인당 1,000,000원       마. 지원 조건: 파견",2011-10-14 00:00:00.0
역사교육과,[수강안내] 2011-동계학기 교류학생 신청안내(서울대),https://hisedu.jnu.ac.kr/bbs/hisedu/2296/783002/artclView.do,"2011학년도 동계학기 교류학생(서울대) 신청과 관련하여 아래와 같이 안내하오니, 관심있는 재학생들은 필히 참고하여 주시기 바랍니다.1. 신청기한 : 2011. 10. 19. (수) 오전 11시까지2. 수업기간: 2011. 12. 23.~2012. 1. 31.3. 수강료: 이론 40,500원/실습 45,500원4. 수강신청 방법: 수강신청사이트 (http://sugang.snu.ac.kr)에 접속하여 직접신청5. 개설 교과목 확인: 서울대 포털 마이스누 (http://my.snu.ac.kr)→수강편람→2011 겨울학기→해당교과목 상",2011-10-14 00:00:00.0
역사교육과,[신청안내]2011학년도 2학기 맞춤형 글쓰기 워크숍 신청 안내,https://hisedu.jnu.ac.kr/bbs/hisedu/2296/782998/artclView.do,"기초교육원 교수학습지원센터에서는 재학생의 보고서/서평 및 소감문 작성 능력을 향상시키고자 다음과 같이 2011학년도 2학기 맞춤형 글쓰기 워크숍을 실시하오니, 관심있는 재학생들은 필히 참고하시어 신청하시기 바랍니다.                 1. 프로그램명 : 맞춤형 글쓰기 워크숍                 2. 대    상 : 전남대학교 학부 재학생                 3. 신청 기간 : 2011. 10. 10. ~ 10. 21.                 4. 신청 방법 : 기초교육원 교수학습지원센터 홈페이지",2011-10-14 00:00:00.0
역사교육과,[모집안내]조선에듀케이션 자기주도학습 멘토링 캠프 멘토 모집,https://hisedu.jnu.ac.kr/bbs/hisedu/2296/782997/artclView.do,"조선일보의 교육법인 조선에듀케이션에서는 2011년 겨울 초5~중3 학생들을 대상으로 학습 동기 부여를 위한 “자기주도학습 멘토링 통학 캠프” 통학 캠프를 개최하고 캠프에 함께할 대학생들을 첨부파일과 같이 모집한다 하오니 관심있는 학생들은 필히 참고하시어 신청하시기 바랍니다,",2011-10-14 00:00:00.0
역사교육과,2011년도 동계 한국대학생 해외봉사단 단원 모집 안내,https://hisedu.jnu.ac.kr/bbs/hisedu/2296/783001/artclView.do,"한국대학사회봉사협의회에서 주관하는 2011년도 동계 단기 23기 한국대학생 해외봉사단 파견을 아래와 같이 모집하오니 관심있는 학생들은 필히 참고하시기 바랍니다.          가. 모집대상            - 학  생 : 5명(휴학생 및 대학원생 제외)                   나. 모집기간 : 2011. 10. 14.(금)까지          다. 제출서류 : 지원서, 성적증명서, 관련 증빙서류(교직원은 지원서만 작성)          라. 제출방법            - 대사협 홈페이지(http://kucss.o",2011-10-12 00:00:00.0
역사교육과,[선발안내] 2011년 동계 세계교육기행 모집 안내,https://hisedu.jnu.ac.kr/bbs/hisedu/2296/783000/artclView.do,"학생들의 자발적 계획에 따른 국외체험학습, 국외봉사, 국제교류활동을 지원함으로써 글로벌 인재를 양성하기 위하여 2011년 동계 세계교육기행 참가자 선발을 다음과 같이 시행한다고 하오니 관심있는 재학생들은 필히 참고하시어 신청하시기 바랍니다.가. 선발팀수: 총 40개 팀 내외(약 200명, 팀당 구성인원 4~6명)            - 교직원 인솔 팀 : 10팀 내외- 학생 주도 팀 :30팀 내외나. 주요 추진 일정1) 모집공고 및 접수: 2011.10.4(화) ~ 10.21(금)2) 서류심사: 2011.10.24(월) ~ 11",2011-10-12 00:00:00.0
역사교육과,[교환안내] 2012-봄학기 파견 교환학생 선발안내,https://hisedu.jnu.ac.kr/bbs/hisedu/2296/782999/artclView.do,"2012년 봄학기 국외 자매대학 파견 교환학생을 아래와 같이 선발한다고 하오니, 관심있는 재학생들은 필히 참고하시어 신청하시기 바랍니다.  1. 온라인 접수기간: 2011. 9. 14(수)~26(월) 2. 신청서 접수방법: 온라인 접수 후 본부 1층 국제협력과로 방문 접수                 3. 파견대학 및 선발 예정인원: 5개국 14개 대학 40명 (일본, 동남아)         4. 파견기간: 2012년 2월 ~ 2013년 2월 중 학기제 또는 학년제 파견 5. 주요 추진일정- 모집공고 및 신청서 접수: 2011.9.",2011-09-21 00:00:00.0
역사교육과,[학생증안내] 2011-2학기 학생증발급 신청안내,https://hisedu.jnu.ac.kr/bbs/hisedu/2296/782996/artclView.do,"2011학년도 2학기 학생증발급 신청에 관하여 아래와 같이 안내하오니, 학생증발급이 필요한 재학생들은 필히 신청하시어 발급받으시기 바랍니다.1. 발급대상 : 2011학년도 후기 신입생 및 복학생  2. 발급기간 : 수시  3. 신청방법 : 개인별 신청 발급(직접 방문)4. 발급장소 :- 광주캠퍼스 : 본부 1층 종합서비스센터 - 여수캠퍼스 : 여수 학생회관 2층 취업지원팀5. 준비물 : 신분증 및 사진1매(반명함판).",2011-09-21 00:00:00.0
역사교육과,[교환안내] 2012년 미주파견 교환학생 추가선발 안내,https://hisedu.jnu.ac.kr/bbs/hisedu/2296/782995/artclView.do,"2012년 미주파견 교환학생을 아래와 같이 추가선발한다고 하오니, 관심있는 재학생들은 필히 참고하시어 신청하시기 바랍니다.  1. 온라인 접수기간: 2011. 9. 14(수)~26(월) 2. 신청서 접수방법: 온라인 접수 후 본부 1층 국제협력과로 방문 접수                 3. 파견대학 및 선발 예정인원: 2개국 4개 대학 10명 (미국,캐나다)         4. 파견기간: 2012년 2월 ~ 2013년 2월 중 학기제 또는 학년제 파견 5. 주요 추진일정- 모집공고 및 신청서 접수: 2011.9.14(수)~9.26",2011-09-21 00:00:00.0
역사교육과,[실습안내] 2012년 정부지원 미국교육실습생 모집안내(20주),https://hisedu.jnu.ac.kr/bbs/hisedu/2296/782994/artclView.do,"공주교육대학교 국제교육센터에서는 교육대학생, 사범대학생(교직이수자포함) 및 학부 졸업자(졸업 후 1년 이내)를 대상으로 2012학년도 1학기(20주) 미국교육실습 프로그램에 참가 할 학생을 모집한다고 합니다.    상기 프로그램에 대한 안내자료를 첨부하오니, 관심있는 재학생들은 참고하시어 신청하시기 바랍니다.1. 접수안내- 서류접수기간 : 2011. 9. 26(월)~2011. 9. 30.(금)- 접수비 납부: 35만원/(우체국, 국제교육센터, 312462-01-005038)/2011.10.10.~12.납입 - 접수방법: ① 접수",2011-09-21 00:00:00.0
역사교육과,[수강안내] 2011-동계학기 개설과목 수요조사 안내,https://hisedu.jnu.ac.kr/bbs/hisedu/2296/782993/artclView.do,"2011학년도 동계계절학기 개설교과목 수요조사를 아래와 같이 실시한다고 하오니, 관심있는 재학생들은 필히 참고하시어 신청하시기 바랍니다.1. 기간 : 2011. 9. 15.(목) - 9. 23.(금)2. 방법 : 인터넷(전남대학교 포털) 실시, 2과목까지 신청 가능. 자세한 사항은 첨부파일(계절학기 수요조사 메뉴얼)을 참고하시기 바랍니다.",2011-09-21 00:00:00.0
역사교육과,[등록안내] 2011학년도 2학기 최종 등록기간 안내,https://hisedu.jnu.ac.kr/bbs/hisedu/2296/782992/artclView.do,우리 대학교 2011학년도 제2학기 최종 추가 등록기간을 아래와 같이 공고하오니 등록금을 납부하지 못한 학생 및 학자금 추가 대출 신청자는 반드시 다음 기간내 등록금을 납부하시기 바랍니다.1. 기  간 : 2011. 9. 27.(화) ~ 9. 28.(수) [2일간]2. 납입금 납부장소 : 광주은행 및 농협전국 본·지점(지역농협 포함)3. 휴학 및 복학 신청 : - 우리대학 홈페이지 - 포털 - 로그인 - 교육지원 - 내학사행정 - 학적  - 휴·복학신청4. 유의사항- 이번 등록기간에 등록하지 못할 학생은 미등록휴학(휴학종류 :,2011-09-21 00:00:00.0
역사교육과,[수강안내] 2011-2학기 교과(학수)구분 정정신청 안내,https://hisedu.jnu.ac.kr/bbs/hisedu/2296/782991/artclView.do,"2011학년도 2학기 교과(학수)구분 정정신청에 관하여 아래와 같이 안내하오니, 해당되는 재학생들은 필히 참고하시어 학과사무실에 신청서를 제출하시기 바랍니다.1. 교과구분 정정기간(주전공/부·복수전공 공통) - 2011. 10. 4.(화) 09:00~10. 11.(화) 18:00- 위 기간동안 학과사무실에서 정정신청서를 작성하시어 제출하시기 바랍니다.2. 정정신청 종류- 교과구분 정정신청(성적조회) : 기 이수한 교과목에 대한 교과구분 정정신청- 교과구분 정정신청(수강조회) : 2011.1학기 수강신청한 교과목에 대한 정정신청3.",2011-09-21 00:00:00.0
역사교육과,[교육안내] 학술정보 활용 교육안내(도서관),https://hisedu.jnu.ac.kr/bbs/hisedu/2296/782990/artclView.do,"도서관에서 학술정보 활용 교육을 아래와 같이 시행한다고 하오니, 관심있는 재학생들은 교육신청하시기 바랍니다.1. 개설 교육 : 인문사회 분야  2. 교육 일자- 9월 20일(화)- 9월 26일(월) 3. 교육 시간- 15:00 ~ 16:00 4. 교육 내용-  검색 전략, 정보원 종류, 정보원별 검색 방법, 리포트 구성5. 교육 장소- 중앙도서관 시청각실(5층)6. 신청 대상- 학부생7. 신청 방법- 도서관 홈페이지→ My Library→ 학술정보 활용 교육   → 도서관 개설교육8. 교육 문의- 교육연구지원팀 이병남(☎ 530-3",2011-09-21 00:00:00.0
역사교육과,[수강안내] 2011-2학기 수강취소 신청안내,https://hisedu.jnu.ac.kr/bbs/hisedu/2296/782989/artclView.do,"2011학년도 2학기 수강취소에 관한 사항을 아래과 같이 안내하온, 수강취소를 예정하는 재학생들은 필히 서류제출하시기 바랍니다.1. 취소기간 - 2011. 9. 28.(수)～9. 30.(금) 09:00～18:00- 답사를 가는 재학생들은 미리 수강취소원에 강의담당 교수님의 날인을 받아 9월 27일(화)까지 학과사무실로 제출하시기 바랍니다. 2. 장소 - 소속 단과대학 행정실 3. 수강취소 과목 범위- 수강취소 신청과목은 2과목 이내로 하되 취소 후 총 수강 학점은 1학점 이상을 유지해야 한다.4. 수강취소 방법 및 절차- 수강신청취",2011-09-21 00:00:00.0
역사교육과,[취업안내] 2011년 공무원 7급반(온라인강좌) 모집안내,https://hisedu.jnu.ac.kr/bbs/hisedu/2296/782988/artclView.do,"2011학년도 공무원 7급반(온라인 강좌) 모집에 관하여 아래와 같이 안내하오니, 관심있는 재학생들은 필히 참고하시기 바랍니다.1. 강좌 운영 개요  가. 강좌방법 : 인터넷 온라인 강의  나. 운영 기간 : 2011. 10. 1. - 2012. 2. 29. (5개월)  다. 모집예상인원 : 130명 내외 (예산 범위 내에서 조정 가능)  라. 모집 대상 : 2, 3, 4학년 재학생(휴학생 포함)  마. 대상 직렬 : 7급 공무원 과정(행정, 세무, 교육행정, 감사, 검찰, 법원, 출입국관리, 관세 등 기타) 2. 신청기간 및 방법",2011-09-21 00:00:00.0
역사교육과,[등록안내] 2011-2학기 추가 등록기간 안내,https://hisedu.jnu.ac.kr/bbs/hisedu/2296/782987/artclView.do,"2011학년도 2학기 추가 등록에 관하여 아래와 같이 안내하오니, 해당 학생들은 필히 참고하시기 바랍니다.1. 기간-  2011.09.14.(수) ~ 2011.09.16.(금)2. 등록장소- 광주은행 및 농협 전국 본,지점(지역농협포함)3. 유의사항- 2011. 2학기 정부보증 학자금 대출이 확정된 학생은 반드시 장학재단과 대출약정을 체결하여 등록금을 납부할 수 있도록 지도 요망",2011-08-30 00:00:00.0
역사교육과,[장학안내] 2011-2 차상위계층(희망드림) 장학금 신청안내,https://hisedu.jnu.ac.kr/bbs/hisedu/2296/782986/artclView.do,"교육과학기술부 2011.2학기 차상위계층(희망드림)장학금 지원제도를 다음과 같이 안내하오니 해당 학생은 빠짐없이 장학금을 신청 할 수 있도록 하여 주시기 바랍니다.                                                                      - 다     음 -1. 신청대상 : 3-4학년 재학생으로 차상위계층 대상자 본인 또는 자녀                    (10학번, 11학번 신청제외)2. 기본사항 1) 차상위계층 장학금 신청은 온라인((www.kosaf.go.kr)으로만",2011-08-22 00:00:00.0
역사교육과,[졸업안내] 2010학년도 후기 졸업식 안내,https://hisedu.jnu.ac.kr/bbs/hisedu/2296/782985/artclView.do,"2010학년도 후기 졸업식을 아래와 같이 안내하오니, 해당 졸업예정자들은 필히 참고하여 주시기 바랍니다.1. 졸업식 일시- 2011년 8월 26일(금) 11:002. 졸업식 장소- 사범대학 2호관 106강의실3. 유의사항- 졸업증서 및 교원자격증은 학과사무실에서 해당 졸업식날 배부합니다.- 학사복은 학과사무실에서 대여해드리며, 오후 2시까지 필히 학과사무실로 반납하시기 바랍니다.졸업을 축하드립니다. 대학 다니신다고 정말 고생 많으셨습니다.",2011-08-08 00:00:00.0
역사교육과,[1학년공지] 생활영어2 수강신청 사항 안내,https://hisedu.jnu.ac.kr/bbs/hisedu/2296/782984/artclView.do,"2011학년도 제2학기 생활영어2를 이수하여야 할 1학년 재학생들께 알려드립니다. 1.해당 교과목은 본부 학사관리과에서 일괄 수강입력을 처리했다고 하시네요.즉 생활영어2를 따로 수강신청하실 필요없다는 이야기입니다. 단지 수강신청 내역에 생활영어2가 있는지만 확인하세요.2.참고로 해당 교과목을 수강내역에서 삭제하실 수 있습니다만, 여석이 많지않아서 한번 삭제하시면 다시 수강신청하시기 아주 어렵습니다. 그러니 정말 피치 못할 사항이 아닌 이상 그대로 두시는 것을 권장합니다.이상입니다.",2011-08-03 00:00:00.0
역사교육과,[봉사안내] 2011-1학기 사이버가정학습 결과안내,https://hisedu.jnu.ac.kr/bbs/hisedu/2296/782979/artclView.do,"지난 1학기에 시행되었던 2011년 광주 사이버가정학습 대학생 튜터 교육봉사활동확인서가 학과사무실에 도착하였습니다.이와 관련한 결과를 다음과 같이 안내하오니, 해당 재학생은 필히 참고하시기 바랍니다.1. 결과 (총 6명)- 94457 : 15시간- 90003 : 15시간- 105709 : 15시간- 91276 : 15시간- 102150 : 35시간- 103187 : 15시간이상입니다.다음 학기에도 광주사이버가정학습 대학생 튜터가 시행될 것으로 예상됩니다. 많은 신청 부탁드립니다.",2011-08-03 00:00:00.0
역사교육과,[학사안내] 2011-2학기 수강신청 및 학사사항 상담안내,https://hisedu.jnu.ac.kr/bbs/hisedu/2296/782978/artclView.do,"2011년도 2학기 수강신청 및 학사사항 상담에 관하여 아래와 같이 안내하오니, 재학생들은 필히 참고하여 주시기 바랍니다.1. 수강신청 및 학사사항 상담- 본인이 졸업하기 위해서는 교양 ?학점, 전공?학점, 일선?학점이 남았는지 알고 싶은 경우- 본인이 교원자격증을 취득하기 위해서 기본이수분야 및 과목은 무엇이 남았는지, 이번 학기에 무슨 교과목을 꼭 들어야하는지 알고 싶은 경우- 위 사항 외에 학사관련 사항이 알고 싶은 경우.2. 상담기간- 8월 3일(수)~8월 19일(금), 오후2시~5시3. 참고사항- 방학 중에 타지역에 거주하",2011-08-02 00:00:00.0
역사교육과,[특강안내] 임용대비 교육학이론 특강,https://hisedu.jnu.ac.kr/bbs/hisedu/2296/782977/artclView.do,"전남대학교 교육문제연구소(교육학과 운영)에서 올해 교원임용고사 대비 교육학 이론 특강을 운영한다고 합니다. 수강비가 교재비 만원만 내면된다고 하니, 3~4학년들이 한번씩 들어도 많은 부담은 되지 않을 것 같습니다. 이하 내용은 특강안내문 사항입니다. 참고하세요.-----------------------------------------------------------------------------------------교원임용고사 대비 교육학 이론 특강- 교원임용시험 대비 교육학 이론 총정리- 교육학 전공 전문가들의 체계적인 팀티칭-",2011-08-02 00:00:00.0
역사교육과,[수강안내] 2011학년도 2학기 수강신청 일정 안내,https://hisedu.jnu.ac.kr/bbs/hisedu/2296/782982/artclView.do,"2011학년도 2학기 수강신청 일정에 관하여 아래와 같이 안내하오니, 재학생들은 필히 참고하시기 바랍니다.1. 수강희망 과목 예약 신청- 일시: 2011. 8. 8.(월)- 8. 9.(화) 08:30～18:00- 대상: 학부 전학년 공통         * 학부생만 해당(대학원생 제외)         * 수강희망과목 예약을 하였더라도 수강신청이 확정된 것이 아니며 반드시 확정 수강신청기간에           수강신청을 하여야 함2. 수강 신청- 대상:  재학생, 타대학 교류학생, 재입학자, 시간제 등록생, 2011. 2학기 복학자 또",2011-07-28 00:00:00.0
역사교육과,[장학안내] 2011년도 남구장학회 장학생 선발 안내,https://hisedu.jnu.ac.kr/bbs/hisedu/2296/782976/artclView.do,"2011년도 남구장학회에서는 지역 인재를 발굴 육성하고 교육발전에 기여하고자  제6회 장학생을 선발한다고 하오니, 해당 지역에 거주하는 재학생들은 필히 참고하시기 바랍니다.           가. 선발 인원 : 대학생 20명                       나. 신청자격                - 공고일 현재 광주광역시에 주소를 둔 광주광역시내 학교에 재학 중인 학생                                     다.  선정요건                - 가정 형편이 어려운 저소득층 가정의 학생으로서",2011-07-28 00:00:00.0
역사교육과,[3학년이하 교직안내] 교육봉사활동과 학교현장실습,https://hisedu.jnu.ac.kr/bbs/hisedu/2296/783011/artclView.do,"2009학년도 입학자(3학년생)부터 변경된 교직 교과과정이 적용되어 아래와 같이 변동되었사오니, 해당되는 재학생들은 필히 참고하시기 바랍니다.[ 교육실습1+교육실습2  VS 교육봉사활동+학교현장실습 ]1.[舊] 교육실습1+교육실습2- (3학년 2학기): 교육실습1 (봉사활동/ 1학점, 30시간)- (4학년 1학기): 교육실습2 (교생실습/ 3학점, 6주)2.[新] 교육봉사활동+학교현장실습- (3학년 2학기): 교육봉사활동 (2학점, 60시간)- (4학년 1학기): 학교현장실습(2학점, 4주)2012년도 1학기부터 교육실습2(3학점,",2011-07-13 00:00:00.0
역사교육과,[교류안내] 2011-2학기 타대학 교류학생 신청안내,https://hisedu.jnu.ac.kr/bbs/hisedu/2296/782975/artclView.do,"2011학년도 제2학기 타 대학교(서울대, 부산대, 전북대, 순천대, 경북대, 강원대) 수학에 관한 사항을 다음과 같이 안내하오니 수학을 희망하는 학생은 제출서류를 해당 신청 기한 전까지 역사교육과 사무실(사범3-206)을 경유하여 행정실에 제출해 주시기 바랍니다.※ 아래의 제출기한은 행정실에서 본부에 제출하는 기한입니다.   최소한 제출기한 오전까지는 행정실에 제출하시기 바랍니다.1. 서울대- 제출기한: 2011.7.13.(수)               * 기한내 미제출시 교류 선발 제외- 수업기간: 2011. 9. 1.(목) ~",2011-07-12 00:00:00.0
역사교육과,"[휴복학안내] 2011-2학기 휴,복학신청 안내",https://hisedu.jnu.ac.kr/bbs/hisedu/2296/782981/artclView.do,"2011-2학기 휴,복학 신청과 관련하여 아래와 같이 안내하오니, 해당 재학생들은 필히 참고하여 신청하시기 바랍니다.1. 복학신청기간   - 조기복학 : 2011. 8. 1(월) ~ 8. 10(수)      (조기복학자는 등록금 고지서를 8월 16일 이후에 전남대 홈페이지 포털 사이트에서 출력하여 사용)   - 일반복학 : 2011. 8. 1(월) ~ 8. 25(목)   - 신청방법 : 전남대 홈페이지-포털 로그인-교육지원-내 학사행정-휴.복학신청에서 신청2. 휴학신청기간   - 미등록휴학 : 2011. 8. 22(월) ~ 8. 2",2011-07-03 00:00:00.0
역사교육과,[장학안내]2011-2학기 미래드림 장학신청 안내,https://hisedu.jnu.ac.kr/bbs/hisedu/2296/782980/artclView.do,"2011학년도 2학기 교육과학기술부 국가 기초생활수급자[미래드림] 장학금 신청에 관하여 아래와 같이 안내하오니, 해당 재학생들은 필히 참고하여 신청하시기 바랍니다.1. 신청 자격- 국내 고등교육기관 학부에 재학 중인 대한민국 국적의 기초생활 수급자로 성적기준을 충족한 자 (복학, 재입학, 편입학 예정자 포함)※단, 학생 본인명의로 수급자 증명서 발급받은 자에 한함2. 기본사항 1) 기초생활수급자 장학금 신청은 온라인((www.kosaf.go.kr)으로만 신청    - 우선감면 대상자(계속) : 제출서류없음    - 우선감면 비대상자",2011-07-03 00:00:00.0
역사교육과,[장학안내] 2011-2학기 우수드림 장학신청 안내,https://hisedu.jnu.ac.kr/bbs/hisedu/2296/782974/artclView.do,"2011년 2학기 저소득층 성적우수(우수드림) 장학금 신청을 아래와 같이 안내하오니, 해당 재학생들은 필히 참고하여 신청하시기 바랍니다. 1. 신청자격 - 국내 고등교육기관 학부에 재학 중인 대한민국 국적의 소득 5분위이하 대상자로 아래의 성적 및 학점요건을 충족한 자를 대상으로 선발(정규학기 이내)- 학생의 가구소득 5분위 이하인 자 (기초생활수급자 포함) 2. 기본사항 1) 저소득층 성적우수 장학금 신청은 온라인((www.kosaf.go.kr)으로만 신청    - 재입학, 편입생 : 장학금 신청서 및 서약서, 주민등록등본, 성적",2011-07-03 00:00:00.0
역사교육과,[장학안내] 2011년도 한국장학재단 다문화가정 학생멘토링 신청안내,https://hisedu.jnu.ac.kr/bbs/hisedu/2296/782973/artclView.do,"2011년도 한국장학재단 다문화가정 학생 멘토링 국가근로장학사업 신청에 관하여 아래와 같이 안내하오니, 관심있는 장학생들은 참고하여 신청하시기 바랍니다.============================================================================================  다문화가정 자녀들이 한국인으로서 올바른 정체성을 갖고 당당하게 살아갈 수 있도록 다문화가정 학생의 학습, 상담 등을 지원토록 우리대학 학생들의 다문화가정 학생 멘토를 다음과 같이 선발하니 관심있는 학생들의 많은 참여,",2011-07-03 00:00:00.0
역사교육과,[학자금융자안내] 2011-2학기 농어촌 출신대학생 학자금 융자 신청안내,https://hisedu.jnu.ac.kr/bbs/hisedu/2296/782972/artclView.do,"2011년도 2학기 농어촌 출신대학생 학자금 융자(무이자) 신청에 관하여 아래와 같이 안내하오니, 해당 재학생은 참고하여 신청하시기 바랍니다. ● 신청기간  :  ‘11.7.4(월) ∼ ‘11.7.15(금), 2주간● 신청방법 : 재단홈페이지(http://www.kosaf.go.kr) → 공인인증서 로그인 → 학자금대출                    안내 → 농어촌출신대학생학자금융자 → 신청하기 클릭● 지원자격 :  농어촌지역에 주소를 두고 6개월(180일) 이상 거주하고 있는 학부모의 대학                    생",2011-07-03 00:00:00.0
