학부,제목,링크,내용,작성일
역사교육과,"[교류안내] 2014학년도 2학기 타 대학교(서울대,충북대) 교류학생 수학 안내",https://hisedu.jnu.ac.kr/bbs/hisedu/2296/783563/artclView.do,"2014학년도 2학기 타 대학교 수학에 관한 사항을 다음과 같이 안내하오니 수학을 희망하는 학생은 해당기한까지 학과사무실로 수학신청원을 제출하여 주시기 바랍니다. 가. 교류 내용 (신청기한은 본 게시글의 신청기한에 따를 것, 학교홈페이지 기간X)대학명신청기한수업기간개설교과목 확인비 고서울대2014.7.11.(금)오후 12시까지2014.9.1.(월)~12.12.(금)서울대 홈페이지 www.snu.ac.kr →주요서비스→수강편람→상세조회(년도수정)*희망 단과대학별로 제출서류가 별도 있음(붙임 수학안내문 참조)*서울대에서 기 이수한",2014-07-08 00:00:00.0
역사교육과,"[교류안내] 2014학년도 2학기 타 대학교(전북대,경상대,충남대) 교류학생 수학 안내",https://hisedu.jnu.ac.kr/bbs/hisedu/2296/783562/artclView.do,2014학년도 2학기 타 대학교 수학에 관한 사항을 다음과 같이 안내하오니 수학을 희망하는 학생은 해당기한까지 학과사무실로 수학신청원을 제출하여 주시기 바랍니다.  가. 교류 내용 (신청기한은 학교홈페이지 공지사항이 아닌 본 게시글 기한에 따를 것)대학명신청기한수업기간개설교과목 확인수강신청 기간 전북대2014.7.21.(월)2014.9.1.(월) ~12.23.(화)전북대 홈페이지(www.jbnu.ac.kr) →전북대포털(오른쪽하단)→개설강좌(오른쪽 상단)→2014학년도 2학기 조회 ※2014.7.21.(월) 이후 조회*장바구니,2014-07-08 00:00:00.0
역사교육과,"[교류안내] 2014학년도 2학기 타 대학교(경북대,한국교원대) 교류학생 수학 안내",https://hisedu.jnu.ac.kr/bbs/hisedu/2296/783561/artclView.do,2014학년도 2학기 타 대학교 수학에 관한 사항을 다음과 같이 안내하오니 수학을 희망하는 학생은 해당기한까지 학과사무실로 수학신청원 제출하여 추천하여 주시기 바랍니다. 가. 교류 내용 (신청기한은 학교홈페이지 공지사항이 아닌 이 게시 기한에 따를 것)대학명신청기한수업기간개설교과목 확인수강신청 기간 경북대2014.7.15.(화)2014.9.1.(월)~12.19.(금)경북대 홈페이지→학사정보→ 수업시간 및강의계획서[http://syllabus.knu.ac.kr]※2014.7.11.(금)시간표확정예정2014.8.12.(화) 14:0,2014-07-08 00:00:00.0
역사교육과,[봉사안내] 2014학년도 전대사대부고 학술 ․ 문화 발표회 교육봉사자 모집안내,https://hisedu.jnu.ac.kr/bbs/hisedu/2296/783560/artclView.do,"2014학년도 전대사대부고 학술 ․ 문화 발표회 교육봉사자 모집(전남대학교사범대학부설고등학교)  ?xml:namespace prefix = ""o"" ns = ""urn:schemas-microsoft-com:office:office"" / 1. 교육봉사 활동의 목적대학생들에게 교육봉사활동을 통하여 실천 위주의 교사양성교육의 강화와 현장 체험의 기회를 제공한다.  2. 교육봉사 시기 : 2014년 7월 10일 ~ 7월 21일  3. 교육봉사 시간 : 개인당 5시간~30시간  4. 모집기한 : 공고날 ~ 7월 9일(수)(담당교사와 연락이",2014-07-07 00:00:00.0
역사교육과,[모집안내] 「나라사랑 독도사랑 국토탐방」 참가자 모집 안내,https://hisedu.jnu.ac.kr/bbs/hisedu/2296/783559/artclView.do,"영호남지역 대학생들의 화합과 소통을 위해 대학 간 교류사업을 활성화하고, 광복절 69주년을 맞아 우리 고유의 영토인 독도 방문을 통해 대학생들의 역사의식 함양 및 국가관을 고취하고자 「나라사랑 독도사랑 국토탐방」사업 참가자를 모집하오니, 관심있는 재학생들은 참고하여 주시기 바랍니다.  가. 행 사 명: 전남대ㆍ경북대ㆍ부산대 연합 「나라사랑 독도사랑 국토탐방」 나. 탐방기간: 2014. 8. 12.(화) ~ 8. 15.(금) / 3박 4일 다. 장 소: 울릉도, 독도 일대 라. 모집인원: 38명 내외 마. 접수기간: 2014. 7",2014-07-07 00:00:00.0
역사교육과,[지원안내] 학자금 부담경감을 위한 [한국장학재단 전환대출] 시행 안내,https://hisedu.jnu.ac.kr/bbs/hisedu/2296/783558/artclView.do,"「한국장학재단 전환대출」사업이 ‘14. 7. 3.(목)부터 시행되오니 전환대상 학생(졸업생 포함)들은 참고하시어 많은 신청하시기 바랍니다.  ?xml:namespace prefix = ""o"" ns = ""urn:schemas-microsoft-com:office:office"" /❍ 지원 대상: 학자금대출 취급당시 학부생 및 대학원생으로 現 졸업생 및 학부생(대학원생 포함) ❍ 지원 범위: ICL제도(취업후 상환 학자금 대출) 도입(‘2010) 이전 학자금 대출자 중 현재 대출 잔액을 보유한 대상자에 한해 지원 가능- 정부보증학자금",2014-07-07 00:00:00.0
역사교육과,[선발안내] 2014년 주한독일문화원 광주어학센터 장학생 선발 안내,https://hisedu.jnu.ac.kr/bbs/hisedu/2296/783557/artclView.do,"주한독일문화원과 전남대학교 간의 협약에 따라 독일어 어학훈련 장학생을 선발한다 하오니 관심있는 학생들은 참고하여 주시기 바랍니다.   1. 파견기관: 독일 주재 13개 Goethe-Institut 중 1개 기관 2. 파견기간: 2014. 12월 ~ 2015. 2월중 4주간 3. 선발인원: 2명 4. 추진일정구 분기 간비 고공고 및 접수2014.7.7.(월)~8.14.(목) 16:00까지- 국제협력본부 서류 제출서류전형2014.8.18.(월)~8.22.(금)  ?xml:namespace prefix = ""o"" ns = ""urn:s",2014-07-07 00:00:00.0
역사교육과,[채용안내] 2014학년도 제6회 전남대학교 계약직원 경력경쟁채용시험 공고 안내,https://hisedu.jnu.ac.kr/bbs/hisedu/2296/783556/artclView.do,"2014학년도 제6회 전남대학교 계약직원 경력경쟁채용시험을 다음과 같이 공고하오니 관심있는 학생(졸업생)들은 참고하여 주시기 바랍니다.  ?xml:namespace prefix = ""o"" ns = ""urn:schemas-microsoft-com:office:office"" / ◆ 채용시험 실시 내역 ◆채용예정직급(채용분야)채용인원담당업무접수기간 및 장소임용예정기관전문계약직라등급(전산원)1○ 홈페이지 개발 및 기획 ○ 대표 홈페이지 운영 및 관리(유지보수 및 서비스 개발)○ 인터넷방송 운영, 블로그, SNS 등 관리2014.07.1",2014-07-07 00:00:00.0
역사교육과,[장학안내] 2014년도 정읍시민장학재단 장학생 선발 안내,https://hisedu.jnu.ac.kr/bbs/hisedu/2296/783555/artclView.do,"2014년 정읍시민장학재단에서 장학생을 다음과 같이 모집한다 하오니, 해당학생은 참고하여 주시기 바랍니다.  ?xml:namespace prefix = ""o"" ns = ""urn:schemas-microsoft-com:office:office"" / 1. 선발 인원: 88명(도내 26명, 서울 27명, 기타 35명) 2. 접수 기간: 2014. 7. 14.(월) ~ 7. 25.(금)(토,일,공휴일 제외) 3. 접수처: 주민등록지 읍·면·동사무소(방문 제출) 4. 장학금액: 1,800,000원 5. 문의사항 연락처: 정읍시 교육체육과",2014-07-04 00:00:00.0
역사교육과,[장학안내] 2014학년도 2학기 농어촌고교출신 장학금 신청 안내,https://hisedu.jnu.ac.kr/bbs/hisedu/2296/783554/artclView.do,"2014학년도 2학기 ‘농어촌고교출신 장학금’ 신청을 다음과 같이 안내하오니, 재학생들은 참고하여 주시기 바랍니다.  ?xml:namespace prefix = ""o"" ns = ""urn:schemas-microsoft-com:office:office"" /구 분내 용1. 장학명▪ 농∙어촌고교출신 장학금2. 장학수혜조건▪ 지원요건: 전국 읍.면 단위 소재의 농∙어촌 고교를 졸업하고, 입학당시부터장학금 지급시까지 부모(부모의 사망, 이혼 등인 경우: 부 또는 모)가 농∙어촌에 거주하고 있는 2014학년도 입학한 학부생▪ 성적요건:",2014-07-03 00:00:00.0
역사교육과,[장학안내] 2014학년도 2학기 신규 국가유공자(자녀 포함) 및 가족장학금 대상자 서류 제출 안내,https://hisedu.jnu.ac.kr/bbs/hisedu/2296/783553/artclView.do,"2014학년도 2학기 신규 국가유공자 또는 그의 자녀 등 법정 장학 대상자나 가족장학금 지급 대상자를 장학생으로 우선 선발하여 장학금을 지급한다 하오니, 해당 학생은 누락되지 않도록 붙임 서식에 따라 증빙서류를 2014. 7. 8(화) 오후 12시까지 학과사무실로 제출하여 주시기 바랍니다.  ?xml:namespace prefix = ""o"" ns = ""urn:schemas-microsoft-com:office:office"" /▣ 장학금 지급 대상자 대상자장학수혜자격제출서류장학금비고신규 국가유공자 또는 그의 자녀 등 법정 장학",2014-07-03 00:00:00.0
역사교육과,[등록안내] 2014학년도 2학기 등록안내,https://hisedu.jnu.ac.kr/bbs/hisedu/2296/783552/artclView.do,"2014학년도 제2학기 등록 공고  ?xml:namespace prefix = ""o"" ns = ""urn:schemas-microsoft-com:office:office"" /2014학년도 제2학기 납입금 납부를 다음과 같이 공고하니 등록에 차질 없으시기 바랍니다.  1. 기 간 : 2014. 8. 25.(월) ~ 8. 28.(목) [4일간]  2. 장 소 : 광주은행 및 농협 전국 본·지점(지역농협 포함) 3. 납입금 분할납부 방법  가. 신청대상 : 경제사정으로 정해진 기간내에 납입금 전액 납부가 어려워 분할(3회) 납부 하고자",2014-07-01 00:00:00.0
역사교육과,[장학안내] 2014학년도 2학기 농어촌희망재단 대학장학생 선발 안내,https://hisedu.jnu.ac.kr/bbs/hisedu/2296/783551/artclView.do,"KRA(한국마사회)에서 2014학년도 2학기 농어촌희망누리 장학생을 아래와 같이 선발한다 하오니  재학생들은 참고하여 주시기 바랍니다. 가.신청자격 및 선발인원장학금 구분신청자격지원금액(1학기/1인)선발인원비고농어촌희망영농 장학금▪ 농어업인 또는 자녀로서 농림수산식품계열재학생 ▪ 졸업 후 영농(1차) 또는 융복합영농(6차) 현장 종사자250만원· 계속(기존) : 5명· 신규 : 적합자  ?xml:namespace prefix = ""o"" ns = ""urn:schemas-microsoft-com:office:office"" /농어촌희",2014-07-01 00:00:00.0
역사교육과,[봉사안내] 2014년 봉선중학교 대학생 멘토 모집 안내,https://hisedu.jnu.ac.kr/bbs/hisedu/2296/783550/artclView.do,"봉선중학교에서는 2014학년도 교육복지우선지원사업 여름방학 기간 중에 시행할 자기주도학습 프로그램과 관련하여 도움을 주실 사범대학 대학생 멘토를 아래와 같이 모집한다 하오니 관심있는 재학생들은 참고하여 주시기 바랍니다.  ?xml:namespace prefix = ""o"" ns = ""urn:schemas-microsoft-com:office:office"" /▣ 2014년 봉선중학교 대학생 멘토 모집 안내 ▣ 가. 프로그램 내용 : 붙임 참조나. 신청기한 :2014년 7월 7일(월) ~7월 18일(금) 선착순 10명다. 신청방법-",2014-06-26 00:00:00.0
역사교육과,[전공안내] 2014학년도 제2학기 부·복수전공 취소 및 이수자 선발 공고,https://hisedu.jnu.ac.kr/bbs/hisedu/2296/783549/artclView.do,"2014학년도 제2학기 부·복수전공 취소 및 이수자 선발 공고  ?xml:namespace prefix = ""o"" ns = ""urn:schemas-microsoft-com:office:office"" /  2014학년도 제2학기 부·복수전공 취소 및 이수자 선발을 아래와 같이 실시하오니 해당 일정에 따라 신청하시기 바랍니다.    1  허용학과(부)  간호대, 수의대, 약대, 예대(미술학과 이론전공 제외), 의대, 자율전공학부를 제외한 전 학과  2  지원자격  가. 복수(연계)전공 : 우리대학에서 제2전공 및 연계전공은 30점 이상",2014-06-26 00:00:00.0
역사교육과,[교육봉사] 교육봉사활동(광주서림초) 지원자 모집 안내,https://hisedu.jnu.ac.kr/bbs/hisedu/2296/783548/artclView.do,"2014년 여름방학 기초부진 학생 지도와 관련하여 광주 서림초등학교에서는 학생 교육봉사활동을 지원받는다 하오니, 관심있는 학생들은 6월 20일(금)까지 학과사무실로 신청하여 주시기 바랍니다.  ?xml:namespace prefix = ""o"" ns = ""urn:schemas-microsoft-com:office:office"" /□ 봉사활동 개요 및 협조 요청 사항 □  가. 봉사활동 지원자 모집1) 봉사활동 내용 : 기초 및 교과부진 학생 지도2) 일 시 : 2014. 7. 28.(월) ~ 2014. 8. 8.(금) (8:30~",2014-06-19 00:00:00.0
역사교육과,[특강안내] 2014학년도 임용 대비 특강 운영안내,https://hisedu.jnu.ac.kr/bbs/hisedu/2296/783547/artclView.do,"2014학년도 임용 대비 특강 일정이 변경되어 안내하오니, 참고하시기 바랍니다.  임용특강 강의는 19~25일까지 인문대 1호관 104 강의실에서 진행될 예정이오니 참고하여 주시기 바랍니다. (30일 특강 장소는 이후공지)     특 강 일 정     ?xml:namespace prefix = ""o"" ns = ""urn:schemas-microsoft-com:office:office"" /변경 전변경 후2014. 6. 19. (목)15:00~18:00역사교육론15:00~18:00중국고중세사        2014. 6. 20. (금)1",2014-06-17 00:00:00.0
역사교육과,[지원안내] 2014년도 2학기 농어촌출신 대학생 학자금융자(무이자)지원사업 신청안내,https://hisedu.jnu.ac.kr/bbs/hisedu/2296/783546/artclView.do,"2014년도 2학기 농어촌출신대학생 학자금융자(무이자) 지원사업을 아래와 같이 시행한다 하오니, 재학생들은 참고하여 신청기간안에 신청하여 주시기 바랍니다.  ?xml:namespace prefix = ""o"" ns = ""urn:schemas-microsoft-com:office:office"" /○ 신청 및 서류 제출기간: 2014. 06. 10.(화) ~ 07. 11.(금) 17:00이전 까지 ○ 제출서류 - 재단 홈페이지에서 농어촌융자 신청 후[신청현황] 화면상의 제출해야 할 서류- 한국장학재단 홈페이지 또는 모바일 업로드- 필",2014-06-17 00:00:00.0
역사교육과,[특강안내] '2015학년도 중등교원 임용시험 준비 전략 특강’ 개최 안내,https://hisedu.jnu.ac.kr/bbs/hisedu/2296/783545/artclView.do,"‘2015학년도 중등교원 임용시험 준비 전략 특강’ 개최 안내  ?xml:namespace prefix = ""o"" ns = ""urn:schemas-microsoft-com:office:office"" /1. 목적○ 임용 시험 준비 과정 안내 통한 임용 시험 준비 지원○ 임용 시험 합격률 제고  2. 대상○ 사범대학 학부생 및 임용 시험에 관심 있는 누구나  3. 내용○ 개최 일시: 2014. 6. 26.(목) 16:00~18:10○ 개최 장소: 사범대학 4호관 110강의실○ 세부 내용: 시간식순담당자16:00~16:05환영사송진한",2014-06-17 00:00:00.0
역사교육과,[교직안내] 2013학년도 후기 교원자격무시험검정 신청 안내,https://hisedu.jnu.ac.kr/bbs/hisedu/2296/783544/artclView.do,"2013년 후기 졸업예정자(기졸업자 중 교원자격취득 대상자 포함)에 대하여 교원자격증 취득을 위한 무시험검정을 다음과 같이 실시하고자 하오니, 2014.06.18.(수)까지 학과사무실에 제출하여 주시기 바랍니다.  ?xml:namespace prefix = ""o"" ns = ""urn:schemas-microsoft-com:office:office"" /1. 대상자 : 2013년 후기 졸업예정자, 기졸업자 중 교원자격취득 대상자 2. 제출서류 : 교원자격무시험검정원서  기타 문의사항은 학과사무실로(530-2370) 연락하시기 바랍니다",2014-06-13 00:00:00.0
역사교육과,[교육봉사] 교육봉사활동 계획 및 확인서 제출 방법 변경 안내,https://hisedu.jnu.ac.kr/bbs/hisedu/2296/783543/artclView.do,"우리대학교 교직과정이수 중인 학생(교육대학원생 포함)들의 교육봉사활동 이수 절차가 전산화됨에 따라 교육봉사활동 계획 및 확인서 제출방식을 새로이 안내하오니, 참고하여 주시기 바랍니다. (2014-2학기부터 적용예정)    ?xml:namespace prefix = ""o"" ns = ""urn:schemas-microsoft-com:office:office"" /당 초변 경교육봉사활동 계획서/확인서 제출학생이 계획서/확인서를 수기 작성하여 학과에 제출 – 학과,대학,교직부 제출학생이 학생포털에 계획/확인서 등록 – 학과,대학,교직부 승",2014-06-13 00:00:00.0
역사교육과,[장학안내] 2014학년도 2학기 국가장학금 1차 신청 안내,https://hisedu.jnu.ac.kr/bbs/hisedu/2296/783542/artclView.do,"2014학년도 2학기 국가장학금 1차 신청을 다음과 같이 안내하오니 재학생들은 참고하여 주시기 바랍니다.  ?xml:namespace prefix = ""o"" ns = ""urn:schemas-microsoft-com:office:office"" /1. 신청 기간: 2014. 6. 10.(화) 09:00 ~ 2014. 6. 30.(월) 18:00    (토․일요일, 공휴일 24시간 신청가능 – 마감일 제외)  2. 서류제출기간 : 2014. 6. 10.(화) 09:00 ~ 2014. 7. 3.(목) 18:00  (서류 제출대상자에 한",2014-06-12 00:00:00.0
역사교육과,[교류안내] 2014학년도 2학기 영호남 교류장학생 선발 안내,https://hisedu.jnu.ac.kr/bbs/hisedu/2296/783541/artclView.do,"2014학년도 2학기 영·호남 교류장학생 한다 하오니, 관심있는 재학생들은 「전남대포털 - 취업·진로」에서 접수기간 내에 접수하여주시기 바랍니다.  가. 선발인원: 경북대학교 40명, 부산대학교 20명, 울산대학교 10명 나. 지원대상: 2학기 이상 이수하고, 전체평점 2.75이상인(2014.1학기 성적 포함) 학부생 다. 모집 및 홍보 - 모집공고: 2014. 6. 12.(목) ~ 2014. 7. 15.(화) / 교내 홈페이지 및 취업·진로- 접수기간: 2014. 6. 25.(수) ~ 2014. 7. 15.(화)- 접수방법:",2014-06-12 00:00:00.0
역사교육과,[임용안내] 2015학년도 공립중등학교교사 임용후보자 선정경쟁시험 사전 예고,https://hisedu.jnu.ac.kr/bbs/hisedu/2296/783540/artclView.do,"2015학년도 공립중등학교교사 임용후보자 선정경쟁시험 사전 예고   ?xml:namespace prefix = ""o"" ns = ""urn:schemas-microsoft-com:office:office"" /역 사  20152014  선발예정인원일반장애광주451전남-22(2)1전북561서울11161경기47604인천7(1)--세종4171부산882울산8111대구104-대전12-충북1171충남28(1)1강원4141경북26242경남116-제주-3-계15921617 ** 2015학년도 임용고시 시험일정 (교육청 공지사항)○ 시험 시행계획 공고",2014-06-12 00:00:00.0
역사교육과,[참여안내] 2014년 국립대학 혁신지원사업 ‘재학생 교육만족도’ 조사 참여 안내,https://hisedu.jnu.ac.kr/bbs/hisedu/2296/783539/artclView.do,"교육부에서「2014년 국립대학 혁신지원사업」 성과평가와 관련하여, ‘재학생 교육만족도’ 조사를 실시한다 하오니, 재학생은 2014. 6.18.(수)까지 골고루 조사에 참여할 수 있도록 협조하여 주시기 바랍니다.  ?xml:namespace prefix = ""o"" ns = ""urn:schemas-microsoft-com:office:office"" /가. 설문조사명 :「2014 국립대학 혁신지원사업」재학생 교육만족도 조사 나. 설문조사 기한 : ’14. 6.18.(수) 다. 조사대상 : 재학생 1~4학년 재학생 전체 라. 조사방법",2014-06-12 00:00:00.0
역사교육과,[참가안내] 2014년도 다문화가정 대상국가 교육글로벌화 지원사업 참가안내,https://hisedu.jnu.ac.kr/bbs/hisedu/2296/783538/artclView.do,"교육부 주최, 유네스코 아시아태평양 국제이해교육원이 주관하여 다문화가정 대상국과의 교사교류를 통한 양국 교사의 글로벌 교육역량 강화 및 상호 이해증진을 위해 추진 중인 「2014년도 다문화가정 대상국가 교육글로벌화 지원사업」 참가자 선발을 위한 공고문 및 사업설명회 안내문을 붙임과 같이 안내하오니, 관심있는 학생들은 참고하여 주시기 바랍니다.  ?xml:namespace prefix = ""o"" ns = ""urn:schemas-microsoft-com:office:office"" /붙임 1. 2014년도 다문화가정 대상국가 교육글로",2014-06-11 00:00:00.0
역사교육과,[참가안내] 2014학년도 국제여름학교2기(일본) 교내참가자 모집안내,https://hisedu.jnu.ac.kr/bbs/hisedu/2296/783537/artclView.do,"국제여름학교2기(일본) 교내 참가자를 아래와 같이 모집한다 하오니 관심있는 학생들은 참고하여 주시기 바랍니다.   ?xml:namespace prefix = ""o"" ns = ""urn:schemas-microsoft-com:office:office"" /1. 목 적: 재학생의 외국어능력 향상 및 국제적 인맥 형성 기회 제공2. 대 상: 전남대 재학생(전공 및 학년제한 없음)3. 모집기간: 2014.6.5.(목)~6.25.(수) 4. 모집인원: 15~20명(예비합격자 포함)5. 참 가 비: 150,000원 6. 혜 택: 홈스테이 참가",2014-06-11 00:00:00.0
역사교육과,[봉사안내] 광주 문화초등학교 대학생 자원봉사자(학습지도) 모집 안내,https://hisedu.jnu.ac.kr/bbs/hisedu/2296/783536/artclView.do,"광주문화초등학교에서는 여름방학교실 프로그램을 운영하여 수급자 및 저소득층을 대상으로 국어, 수학 학습지도를 실시하고자 대학생 자원봉사자를 모집하고 있으니, 관심있는 재학생들은 6월 13일(금) 오후 3시까지 학과사무실로 신청하여 주시기 바랍니다.  ?xml:namespace prefix = ""o"" ns = ""urn:schemas-microsoft-com:office:office"" /  봉 사내 용운 영기 간일 일봉사시간지 도요 일자원봉사필요인원수업형태혜 택담당자 및 연락처국 어수 학  학습지도2014년8월 4일~8월 27일(총",2014-06-03 00:00:00.0
역사교육과,[지원안내] 2014년도 1학기 대학생 학자금 대출이자 원조 안내,https://hisedu.jnu.ac.kr/bbs/hisedu/2296/783535/artclView.do,"전라남도에서는 지역 출신 대학생의 교육비 부담 경감을 위해 대학생 학자금 대출 이자를 지원하고 있으므로 해당 학생들은 대출이자를 지원 신청하여 혜택을 받을 수 있도록 하여 주시기 바랍니다.  ?xml:namespace prefix = ""o"" ns = ""urn:schemas-microsoft-com:office:office"" /가. 지원개요❍ 사업명: 대학생 학자금 대출이자를 지원❍ 지원대상: ‘14년 1학기 한국장학재단 일반상환 학자금 대출을 받은 학부생- 광주캠퍼스: 전라남도에 주소를 두고, 전라남도 소재 고등학교를 졸업한 학",2014-05-22 00:00:00.0
역사교육과,"[교류안내] 2014학년도 타 대학교(조선대,광주대) 하계 계절학기 수학안",https://hisedu.jnu.ac.kr/bbs/hisedu/2296/783534/artclView.do,"2  014학년도 타 대학교 하계 계절학기 운영계획을 다음과 같이 안내하오니, 관심있는 재학생들은 제출서류를 해당 기한까지 학과사무실로 제출하여 주시기 바랍니다.  가. 신청 자격 : 2014년도 1학기 현재 재학중인 자 나. 교류대학 수 : 1개 대학만 가능(우리대학+타대학교류 가능, 타대학+타대학 불가) 다. 계절학기 총 수강 가능 학점 : 우리대학 수강학점과 교류대학 수강학점 포함하여 6학점 이내(이러닝강의 3학점만 인정) 라. 운영 내용대학신청기한수업기간학점당수강료(이론/실습)수강신청 기간 및 방법 개설교과목 확인조선대201",2014-05-22 00:00:00.0
역사교육과,[봉사안내] 2014 교육복지 우선지원사업 학습 멘토(주월중학교) 모집 안내,https://hisedu.jnu.ac.kr/bbs/hisedu/2296/783533/artclView.do,"광주광역시 주월동에 위치한 교육복지우선지원학교인 주월중학교에서 학생들의 교육, 문화, 복지 등 전반에 걸쳐 삶의 질 향상을 위한 다양한 프로그램의 일환으로 학생들의 학습 동기부여와 진로의식을 북돋을 수 있는 학습 멘토링 교육봉사자를 아래와 같이 모집한다 하오니, 관심있는 재학생들은 신청하여 주시기 바랍니다.   * 교육봉사활동으로 인정가능   -------- 아 래 ------- 가. 모집대상 : 사범대학생 및 교직과정이수자 나. 모집기간 : 2014. 5. 19.(월) ~ 2014. 6. 27.(금) 다. 운영방법1) 운영기간",2014-05-22 00:00:00.0
역사교육과,[채용안내] 동원그룹 채용 연계 인턴채용 안내,https://hisedu.jnu.ac.kr/bbs/hisedu/2296/783532/artclView.do,"동원그룹에서 채용 연계 인턴 추천 요청이 있어 다음과 같이 안내하오니 관심있는 학생은 5.16.(금) 제출서류(입사지원서)를 학과사무실로 제출하여 주시기 바랍니다. 1. 추천 요청 사항해당분야지원자격추천인원1) 영업: 전공무관2) 생산/품질: 식품,산업,화학,금속,기계3) 연구: 식품,화학,금속,영양4) 해양: 상경,해양,물어,일어,기계,조선(승선)5) 마케팅:경영,신문방송,디자인6) 사업지원:상겨아부동산,물류,식품,축산,회계7) IT:전산- 4년제 정규대학 기졸업자~2014년 8월 졸업예정자- 외국어 구사 능력 우수자 우대(영",2014-05-14 00:00:00.0
역사교육과,[교류안내] 2014학년도 타 대학교(고려대) 하계 계절학기 수학 안내,https://hisedu.jnu.ac.kr/bbs/hisedu/2296/783531/artclView.do,"2014학년도 타 대학교 하계 계절학기 운영계획을 다음과 같이 안내하오니, 신청자가 있을 경우 제출서류를 해당 기한까지 학과사무실로 제출하여 주시기 바랍니다.  가. 신청 자격 : 2014년도 1학기 현재 재학중인 자 나. 교류대학 수 : 1개 대학만 가능(우리대학+타대학교류 가능, 타대학+타대학 불가) 다. 수강신청 가능 학점 : 6학점 이내(이러닝강의 3학점까지 인정) 라. 운영 내용대학명신청기한수업기간수강료수강신청 기간 학점교류생 등록 절차고려대2014.5.16.(금)까지   ?xml:namespace prefix = ""o",2014-05-14 00:00:00.0
